url,title,saves,timestamp
https://www.pinterest.com/pin/1075093742311367636/,Mississippi Sin Quiche,16,2026-01-19 05:32:10
https://www.pinterest.com/pin/1075093742311331902/,Orange Clove Cookies,16,2026-01-19 05:32:13
https://www.pinterest.com/pin/1075093742311316496/,Crock Pot Crack Potato Soup,16,2026-01-19 05:32:14
https://www.pinterest.com/pin/1075093742309119421/,Parmesan Lemon Orzo,16,2026-01-19 05:34:00
https://www.pinterest.com/pin/1075093742308323505/,Banana Oatmeal Bars,16,2026-01-19 05:34:36
https://www.pinterest.com/pin/one-pan-chicken-meatballs-with-orzo-cooking-circuit--1075093742306445552/,One Pan Chicken Meatballs with Orzo,16,2026-01-19 05:36:04
https://www.pinterest.com/pin/1075093742305944887/,Creamy Cowboy Butter Chicken Linguine,16,2026-01-19 05:36:56
https://www.pinterest.com/pin/1075093742305116884/,Grilled Zucchini Salad,16,2026-01-19 05:37:11
https://www.pinterest.com/pin/1075093742303819913/,Ground Turkey and Zucchini Skillet,16,2026-01-19 05:37:49
https://www.pinterest.com/pin/one-pot-creamy-pesto-chicken-pasta-recipe-cooking-circuit--1075093742302524503/,One Pot Creamy Pesto Chicken Pasta Recipe,16,2026-01-19 05:38:55
https://www.pinterest.com/pin/broccoli-cheddar-orzo-with-chicken-cooking-circuit--1075093742302453545/,Broccoli Cheddar Orzo with Chicken,16,2026-01-19 05:39:01
https://www.pinterest.com/pin/cuban-reuben-recipe-cooking-circuit--1075093742301948423/,Cuban Reuben Recipe,16,2026-01-19 05:39:29
https://www.pinterest.com/pin/dessert-recipes--1075093742300436736/,Air Fryer Apple Pie Bombs Recipe,16,2026-01-19 05:40:21
https://www.pinterest.com/pin/1075093742299250616/,Mushroom Chicken Pasta Recipe,16,2026-01-19 05:41:04
https://www.pinterest.com/pin/1075093742312552424/,Marry Me Cookies,15,2026-01-19 05:31:20
https://www.pinterest.com/pin/1075093742312287664/,Twice Baked Potatoes,15,2026-01-19 05:31:28
https://www.pinterest.com/pin/1075093742311963426/,Mexican White Cheese Dip Recipe,15,2026-01-19 05:31:49
https://www.pinterest.com/pin/1075093742311937572/,Oven Baked Chicken Thighs,15,2026-01-19 05:31:49
https://www.pinterest.com/pin/1075093742311554868/,Irresistibly Chewy Snickerdoodle Cookies Recipe,15,2026-01-19 05:32:03
https://www.pinterest.com/pin/1075093742311463135/,Buckeye Graham Crackers,15,2026-01-19 05:32:07
https://www.pinterest.com/pin/1075093742310356929/,Salted Caramel Apple Crumble Bars,15,2026-01-19 05:32:59
https://www.pinterest.com/pin/1075093742308194986/,Monterey Chicken Rice-A-Roni Casserole,15,2026-01-19 05:34:42
https://www.pinterest.com/pin/1075093742307897167/,Buffalo Chicken Alfredo Penne,15,2026-01-19 05:34:56
https://www.pinterest.com/pin/1075093742307250397/,Healthy Pumpkin Bread,15,2026-01-19 05:35:26
https://www.pinterest.com/pin/1075093742306745457/,Twice Baked Potato Casserole,15,2026-01-19 05:35:49
https://www.pinterest.com/pin/teriyaki-sesame-beef-skewers-cooking-circuit--1075093742306694835/,Teriyaki Sesame Beef Skewers,15,2026-01-19 05:35:51
https://www.pinterest.com/pin/two-ingredient-lemon-bars-cooking-circuit--1075093742306615922/,Two Ingredient Lemon Bars,15,2026-01-19 05:35:55
https://www.pinterest.com/pin/1075093742305394861/,Lemon Pepper Chicken Breasts,15,2026-01-19 05:36:57
https://www.pinterest.com/pin/1075093742305073513/,Vibrant Mexican Street Corn Salad,15,2026-01-19 05:37:12
https://www.pinterest.com/pin/1075093742304181723/,Fiesta Shrimp Bowl,15,2026-01-19 05:37:28
https://www.pinterest.com/pin/cracker-barrel-chicken-dumplings-cooking-circuit--1075093742303049723/,Cracker Barrel Chicken Dumplings,15,2026-01-19 05:38:26
https://www.pinterest.com/pin/salmon-with-garlic-lemon-butter-sauce-recipe-cooking-circuit--1075093742302961111/,Salmon with Garlic Lemon Butter Sauce Recipe,15,2026-01-19 05:38:32
https://www.pinterest.com/pin/lemon-ginger-soy-marinated-grilled-chicken-cooking-circuit--1075093742301565968/,Lemon Ginger Soy Marinated Grilled Chicken,15,2026-01-19 05:39:57
https://www.pinterest.com/pin/1075093742301207149/,Creamy Cajun Chicken Pasta,15,2026-01-19 05:40:17
https://www.pinterest.com/pin/1075093742299939942/,Jalapeno Chicken with Bell Peppers Recipe,15,2026-01-19 05:40:29
https://www.pinterest.com/pin/1075093742299726710/,Broccoli Cheese Casserole Recipe,15,2026-01-19 05:40:35
https://www.pinterest.com/pin/1075093742298623475/,Italian Sugar Cookies Recipe,15,2026-01-19 05:40:53
https://www.pinterest.com/pin/chicken-piccata-with-lemon-sauce-recipe-cooking-circuit--1075093742300013777/,Chicken Piccata with Lemon Sauce Recipe,15,2026-01-19 05:40:56
https://www.pinterest.com/pin/1075093742313280030/,Creamy Garlic Penne Pasta,14,2026-01-19 05:30:42
https://www.pinterest.com/pin/1075093742312943151/,BBQ Meatballs Recipe,14,2026-01-19 05:30:57
https://www.pinterest.com/pin/1075093742312789683/,Valentines Day Slice and Bake Cookies,14,2026-01-19 05:31:38
https://www.pinterest.com/pin/1075093742311769791/,Easy Salisbury Steak,14,2026-01-19 05:32:27
https://www.pinterest.com/pin/1075093742311003036/,Mary Berry Chicken Supreme Recipe,14,2026-01-19 05:32:28
https://www.pinterest.com/pin/1075093742308645280/,Mexican Chicken and Rice with Queso,14,2026-01-19 05:34:19
https://www.pinterest.com/pin/1075093742308236881/,Pepper Chicken Stir Fry Recipe,14,2026-01-19 05:34:42
https://www.pinterest.com/pin/1075093742308001256/,Paleo Egg Roll in a Bowl,14,2026-01-19 05:34:51
https://www.pinterest.com/pin/1075093742307471767/,Creamy Chicken Broccoli Rice Cheese Casserole,14,2026-01-19 05:35:18
https://www.pinterest.com/pin/1075093742307214366/,Cheesy Stuffed Crust Pizza Snacks with Pepperoni,14,2026-01-19 05:35:30
https://www.pinterest.com/pin/1075093742307834864/,Honey Garlic Butter Chicken with Mac &amp; Cheese,14,2026-01-19 05:35:34
https://www.pinterest.com/pin/1075093742306817770/,Easy Cabbage and Sausage Skillet,14,2026-01-19 05:35:45
https://www.pinterest.com/pin/20-minute-mini-baked-chicken-tacos-cooking-circuit--1075093742306392823/,20 Minute Mini Baked Chicken Tacos,14,2026-01-19 05:36:08
https://www.pinterest.com/pin/1075093742305747744/,Breakfast Grilled Cheese,14,2026-01-19 05:37:11
https://www.pinterest.com/pin/1075093742305486651/,Slow Cooker Chicken and Gravy,14,2026-01-19 05:37:27
https://www.pinterest.com/pin/1075093742303797742/,Southwestern Chopped Chicken Salad,14,2026-01-19 05:37:50
https://www.pinterest.com/pin/dinner-recipes--1075093742303069773/,Oriental Ramen Broccoli Cole Slaw,14,2026-01-19 05:38:26
https://www.pinterest.com/pin/broccoli-cauliflower-and-sweet-potato-salad-cooking-circuit--1075093742302723298/,Broccoli Cauliflower and sweet potato Salad,14,2026-01-19 05:38:42
https://www.pinterest.com/pin/savory-breakfast-pockets-recipe-cooking-circuit--1075093742302624988/,Savory Breakfast Pockets Recipe,14,2026-01-19 05:38:48
https://www.pinterest.com/pin/1075093742302411027/,Pesto Chicken Gnocchi Bake,14,2026-01-19 05:39:03
https://www.pinterest.com/pin/1075093742302089263/,Creamy Chicken Fajita Pasta,14,2026-01-19 05:39:23
https://www.pinterest.com/pin/1075093742301632048/,Mushroom Chicken Delight,14,2026-01-19 05:39:53
https://www.pinterest.com/pin/pepper-steak-in-a-crock-pot-recipe-cooking-circuit--1075093742299778732/,Pepper Steak in a Crock Pot Recipe,14,2026-01-19 05:40:31
https://www.pinterest.com/pin/brown-butter-oatmeal-chocolate-chip-cookies-recipe-cooking-circuit--1075093742298819590/,Brown Butter Oatmeal Chocolate Chip Cookies Recipe,14,2026-01-19 05:40:48
https://www.pinterest.com/pin/1075093742312779667/,Heart Shaped Cookie Cake,13,2026-01-19 05:31:05
https://www.pinterest.com/pin/1075093742312704773/,Mini Heart Shaped Cakes,13,2026-01-19 05:31:10
https://www.pinterest.com/pin/1075093742312682454/,Baked Ricotta Chicken,13,2026-01-19 05:31:13
https://www.pinterest.com/pin/1075093742312669388/,Garlic Butter Sautéed Cauliflower with Breadcrumbs,13,2026-01-19 05:31:15
https://www.pinterest.com/pin/1075093742312559669/,Cookie Monster Cookies,13,2026-01-19 05:31:19
https://www.pinterest.com/pin/1075093742312126182/,Creamy Lemon Ricotta Pasta,13,2026-01-19 05:31:38
https://www.pinterest.com/pin/1075093742311637695/,Chicken and Stuffing Casserole,13,2026-01-19 05:32:00
https://www.pinterest.com/pin/1075093742311633385/,Easy Mozzarella Chicken,13,2026-01-19 05:32:00
https://www.pinterest.com/pin/1075093742311310693/,Creamy Ranch Potato Casserole,13,2026-01-19 05:32:15
https://www.pinterest.com/pin/1075093742311196546/,Pasta Napoletana,13,2026-01-19 05:32:19
https://www.pinterest.com/pin/1075093742310397130/,Paula Deen's Corn Casserole,13,2026-01-19 05:32:59
https://www.pinterest.com/pin/1075093742310861213/,Giddy Up And Go Breakfast Cobbler,13,2026-01-19 05:33:10
https://www.pinterest.com/pin/1075093742309804244/,Creamy Garlic Mushroom Chicken Thighs Dinner,13,2026-01-19 05:33:29
https://www.pinterest.com/pin/1075093742308993116/,Creamy Chicken &amp; Rice Casserole,13,2026-01-19 05:34:06
https://www.pinterest.com/pin/1075093742309035530/,Monterey Chicken Spaghetti Casserole Recipe,13,2026-01-19 05:34:26
https://www.pinterest.com/pin/1075093742308547167/,Creamy Oat Milk Ice Cream,13,2026-01-19 05:34:26
https://www.pinterest.com/pin/1075093742308378371/,Chicken Taco Soup with Cream Cheese,13,2026-01-19 05:34:37
https://www.pinterest.com/pin/1075093742308052303/,Chicken and Spinach Casserole with Cream Cheese,13,2026-01-19 05:34:47
https://www.pinterest.com/pin/1075093742308485959/,Sloppy Joe Bowls,13,2026-01-19 05:35:02
https://www.pinterest.com/pin/1075093742307527150/,No-Peek Chicken and Rice,13,2026-01-19 05:35:14
https://www.pinterest.com/pin/1075093742307459932/,No-Peek Chicken Casserole,13,2026-01-19 05:35:19
https://www.pinterest.com/pin/1075093742307152265/,Lemon Chicken Stuffed Manicotti,13,2026-01-19 05:35:32
https://www.pinterest.com/pin/1075093742306903380/,High Protein Cinnamon Roll Baked Oatmeal,13,2026-01-19 05:35:42
https://www.pinterest.com/pin/irresistible-baked-zucchini-cheese-cooking-circuit--1075093742306690224/,Irresistible Baked Zucchini Cheese,13,2026-01-19 05:35:51
https://www.pinterest.com/pin/one-pan-sausage-green-beans-cooking-circuit--1075093742306679687/,One Pan Sausage Green Beans,13,2026-01-19 05:35:52
https://www.pinterest.com/pin/beef-stew-cooking-circuit--1075093742306199855/,Beef Stew,13,2026-01-19 05:36:18
https://www.pinterest.com/pin/low-carb-greek-yogurt-chicken-cooking-circuit--1075093742306123130/,Low Carb Greek Yogurt Chicken,13,2026-01-19 05:36:21
https://www.pinterest.com/pin/1075093742305867687/,Hot Honey Salmon Bites,13,2026-01-19 05:36:34
https://www.pinterest.com/pin/1075093742305700711/,Zucchini Gratin with Yellow Squash,13,2026-01-19 05:36:42
https://www.pinterest.com/pin/1075093742305015581/,"Sheet Pan Chicken, Chipotle &amp; Pineapple Tacos",13,2026-01-19 05:37:14
https://www.pinterest.com/pin/1075093742305344184/,Asian Glazed Turkey Meatballs,13,2026-01-19 05:37:24
https://www.pinterest.com/pin/1075093742304238768/,Teriyaki Chicken Casserole,13,2026-01-19 05:37:24
https://www.pinterest.com/pin/1075093742303419578/,Creamy Sausage and Peppers Pasta,13,2026-01-19 05:38:08
https://www.pinterest.com/pin/1075093742301573245/,Breakfast Strata,13,2026-01-19 05:40:21
https://www.pinterest.com/pin/ground-beef-casserole-recipe-cooking-circuit--1075093742299294361/,Ground Beef Casserole Recipe,13,2026-01-19 05:40:40
https://www.pinterest.com/pin/breakfast-recipes--1075093742299039462/,Breakfast Bombs Recipe,13,2026-01-19 05:41:04
https://www.pinterest.com/pin/1075093742312250508/,Zuppa Toscana soup,12,2026-01-19 05:31:30
https://www.pinterest.com/pin/1075093742311860805/,Italian Hoagie Dip,12,2026-01-19 05:32:13
https://www.pinterest.com/pin/1075093742311076546/,Ritz Cracker Party Sandwiches,12,2026-01-19 05:32:26
https://www.pinterest.com/pin/1075093742311041074/,Bruschetta Dip Recipe,12,2026-01-19 05:32:26
https://www.pinterest.com/pin/1075093742309507087/,Brown Sugar Pineapple Chicken,12,2026-01-19 05:33:45
https://www.pinterest.com/pin/1075093742309217051/,The Ultimate Bang Bang Salmon,12,2026-01-19 05:33:58
https://www.pinterest.com/pin/1075093742308638184/,Chicken Fajita Rice Bake,12,2026-01-19 05:34:20
https://www.pinterest.com/pin/1075093742308756331/,Lazy Chicken Parmesan Bake,12,2026-01-19 05:34:49
https://www.pinterest.com/pin/italian-meatloaf-marinara-cheese-cooking-circuit--1075093742306605373/,Italian Meatloaf Marinara Cheese,12,2026-01-19 05:36:21
https://www.pinterest.com/pin/1075093742305319622/,Honey Garlic Chicken Breast,12,2026-01-19 05:37:00
https://www.pinterest.com/pin/1075093742305334864/,Sheet Pan Sesame Chicken and Broccoli,12,2026-01-19 05:37:00
https://www.pinterest.com/pin/1075093742303723139/,Simple Crockpot Chicken Tacos,12,2026-01-19 05:37:54
https://www.pinterest.com/pin/sheet-pan-lemon-balsamic-chicken-and-potatoes-cooking-circuit--1075093742303399330/,Sheet Pan Lemon Balsamic Chicken and Potatoes,12,2026-01-19 05:38:09
https://www.pinterest.com/pin/1075093742303974453/,Crock Pot Chicken and Rice Recipe,12,2026-01-19 05:38:10
https://www.pinterest.com/pin/1075093742302757731/,Zucchini Tomato Bake,12,2026-01-19 05:38:39
https://www.pinterest.com/pin/1075093742302543288/,Greek Lemon Chicken Soup,12,2026-01-19 05:38:52
https://www.pinterest.com/pin/butter-swim-biscuits-and-gravy-bake-recipe-cooking-circuit--1075093742302009983/,Butter Swim Biscuits and Gravy Bake Recipe,12,2026-01-19 05:39:26
https://www.pinterest.com/pin/1075093742312697213/,Slow Cooker Stuffed Shells with Meat,11,2026-01-19 05:31:12
https://www.pinterest.com/pin/1075093742312050059/,Easy Mexican Rice Recipe,11,2026-01-19 05:31:43
https://www.pinterest.com/pin/1075093742311930142/,Minestrone Soup Recipe,11,2026-01-19 05:31:49
https://www.pinterest.com/pin/1075093742311323980/,Sweet Harmony Honey-Glazed Corn Casserole,11,2026-01-19 05:32:13
https://www.pinterest.com/pin/1075093742309633958/,Halloween Vampire Coconut Blood Fudge,11,2026-01-19 05:33:39
https://www.pinterest.com/pin/1075093742308969134/,Cajun Chicken with Bell Peppers,11,2026-01-19 05:34:08
https://www.pinterest.com/pin/1075093742308927645/,Authentic Jamaican Curry Chicken,11,2026-01-19 05:34:09
https://www.pinterest.com/pin/1075093742308670668/,Hot Honey Feta Chicken Dish,11,2026-01-19 05:34:21
https://www.pinterest.com/pin/1075093742308333294/,Savory Greek Chicken Meatballs with Zesty Lemon Orzo,11,2026-01-19 05:34:37
https://www.pinterest.com/pin/1075093742307746563/,Healthy Chicken Egg Roll in a Bowl Recipe,11,2026-01-19 05:35:03
https://www.pinterest.com/pin/1075093742307577051/,Crock Pot Fiesta Chicken,11,2026-01-19 05:35:11
https://www.pinterest.com/pin/1075093742307398267/,Mediterranean Chicken and Rice,11,2026-01-19 05:35:21
https://www.pinterest.com/pin/1075093742307512021/,Lighter Buffalo Chicken and Rice Skillet,11,2026-01-19 05:35:48
https://www.pinterest.com/pin/baked-pineapple-salmon-cooking-circuit--1075093742306545151/,Baked Pineapple Salmon,11,2026-01-19 05:35:59
https://www.pinterest.com/pin/decadent-strawberry-swirl-cheesecake-cooking-circuit--1075093742306308233/,Decadent Strawberry Swirl Cheesecake,11,2026-01-19 05:36:13
https://www.pinterest.com/pin/crock-pot-lemon-garlic-butter-chicken-thighs-cooking-circuit--1075093742306153989/,Crock Pot Lemon Garlic Butter Chicken Thighs,11,2026-01-19 05:36:20
https://www.pinterest.com/pin/1075093742305377390/,Creamy Tuscan Orzo,11,2026-01-19 05:37:25
https://www.pinterest.com/pin/1075093742305029852/,Beef Stir Fry with Vegetables,11,2026-01-19 05:37:46
https://www.pinterest.com/pin/1075093742304130098/,Baked Salmon with Avocado &amp; Feta,11,2026-01-19 05:37:57
https://www.pinterest.com/pin/1075093742303570156/,Greek Chicken and Lemon Rice,11,2026-01-19 05:38:01
https://www.pinterest.com/pin/1075093742303451467/,Tuscan Skillet Chicken Cacciatore,11,2026-01-19 05:38:07
https://www.pinterest.com/pin/greek-chicken-casserole-cooking-circuit--1075093742303044415/,Greek Chicken Casserole,11,2026-01-19 05:38:26
https://www.pinterest.com/pin/1075093742302693202/,One-Pot Lemon Garlic Chicken and Rice,11,2026-01-19 05:38:41
https://www.pinterest.com/pin/crockpot-grape-jelly-smokies-recipe-cooking-circuit--1075093742301909578/,Crockpot Grape Jelly Smokies Recipe,11,2026-01-19 05:39:31
https://www.pinterest.com/pin/1075093742301754029/,Air Fryer Chicken and Vegetables Recipe,11,2026-01-19 05:39:47
https://www.pinterest.com/pin/1075093742300061200/,Strawberry Danish Recipe,11,2026-01-19 05:40:47
https://www.pinterest.com/pin/ham-and-cheese-croissant-casserole-recipe-cooking-circuit--1075093742298835348/,Ham and Cheese Croissant Casserole Recipe,11,2026-01-19 05:40:49
https://www.pinterest.com/pin/biscuits-and-gravy-breakfast-casserole-recipe-cooking-circuit--1075093742300175319/,Biscuits and Gravy Breakfast Casserole Recipe,11,2026-01-19 05:40:50
https://www.pinterest.com/pin/1075093742312872407/,Slow Cooker Jalapeño Popper Chicken Taquitos,10,2026-01-19 05:31:00
https://www.pinterest.com/pin/1075093742312556909/,Margarita Grilled Shrimp Skewers,10,2026-01-19 05:31:19
https://www.pinterest.com/pin/1075093742311972912/,Jalapeno Popper Crescent Rolls,10,2026-01-19 05:31:47
https://www.pinterest.com/pin/1075093742311522769/,Samoa Cheesecake Recipe,10,2026-01-19 05:32:04
https://www.pinterest.com/pin/1075093742311428081/,Gingerbread Cake Recipe,10,2026-01-19 05:32:11
https://www.pinterest.com/pin/1075093742311162982/,Honey Pineapple Salmon Recipe,10,2026-01-19 05:32:21
https://www.pinterest.com/pin/1075093742311124634/,One-Pot Spinach Tomato Pasta,10,2026-01-19 05:32:56
https://www.pinterest.com/pin/1075093742310411766/,Southern Breakfast Enchiladas with Sausage Gravy,10,2026-01-19 05:32:57
https://www.pinterest.com/pin/1075093742310317174/,Cranberry Brie Stuffed Chicken,10,2026-01-19 05:33:02
https://www.pinterest.com/pin/1075093742309139517/,Meatball Stroganoff Dreamy Cream Sauce,10,2026-01-19 05:34:02
https://www.pinterest.com/pin/1075093742309151013/,Rotini Cheesy Italian Herb Alfredo,10,2026-01-19 05:34:31
https://www.pinterest.com/pin/1075093742307973074/,Healthy Chicken Stir-Fry with Broccoli,10,2026-01-19 05:34:52
https://www.pinterest.com/pin/1075093742307287441/,Perfect Pumpkin Bread Recipe,10,2026-01-19 05:35:24
https://www.pinterest.com/pin/1075093742307211323/,Marry Me Chicken Soup Recipe,10,2026-01-19 05:35:30
https://www.pinterest.com/pin/1075093742307154929/,Buffalo Chicken Enchiladas,10,2026-01-19 05:35:32
https://www.pinterest.com/pin/hobo-casserole-with-ground-beef-potatoes-cooking-circuit--1075093742306541280/,Hobo Casserole with Ground Beef &amp; Potatoes,10,2026-01-19 05:35:59
https://www.pinterest.com/pin/1075093742307246672/,Crustless Coconut Pie with Shredded Coconut and Vanilla,10,2026-01-19 05:35:59
https://www.pinterest.com/pin/1075093742305829226/,Small Batch Vanilla Peach Jam,10,2026-01-19 05:36:36
https://www.pinterest.com/pin/chili-mac-recipe-cooking-circuit--1075093742306218304/,Chili Mac Recipe,10,2026-01-19 05:36:40
https://www.pinterest.com/pin/1075093742305459257/,Tuscan Chicken and Orzo Skillet,10,2026-01-19 05:36:54
https://www.pinterest.com/pin/1075093742305059428/,Chicken Wild Rice Casserole,10,2026-01-19 05:37:14
https://www.pinterest.com/pin/1075093742303877810/,Creamy Tomato White Bean Stew,10,2026-01-19 05:37:45
https://www.pinterest.com/pin/1075093742303800861/,Chicken Blueberry Feta Salad,10,2026-01-19 05:37:49
https://www.pinterest.com/pin/1075093742305303096/,Chicken And Potatoes With Dijon Cream Sauce,10,2026-01-19 05:37:58
https://www.pinterest.com/pin/1075093742304077903/,Jalapeño Popper Chicken Salad,10,2026-01-19 05:38:01
https://www.pinterest.com/pin/1075093742303538307/,Southwest Crock Pot Chicken and Rice,10,2026-01-19 05:38:04
https://www.pinterest.com/pin/bruschetta-chicken-casserole-cooking-circuit--1075093742302650114/,Bruschetta Chicken Casserole,10,2026-01-19 05:38:46
https://www.pinterest.com/pin/creamy-maple-chicken-cooking-circuit--1075093742302323460/,Creamy Maple Chicken,10,2026-01-19 05:39:07
https://www.pinterest.com/pin/creamy-tuscan-salmon-cooking-circuit--1075093742302186167/,Creamy Tuscan Salmon,10,2026-01-19 05:39:13
https://www.pinterest.com/pin/1075093742302099866/,Creamy Chicken Pasta,10,2026-01-19 05:39:21
https://www.pinterest.com/pin/crockpot-grape-jelly-smokies-recipe-cooking-circuit--1075093742299805939/,Crockpot Grape Jelly Smokies Recipe,10,2026-01-19 05:40:30
https://www.pinterest.com/pin/1075093742312659619/,Chicken and Rice Casserole,9,2026-01-19 05:31:14
https://www.pinterest.com/pin/1075093742312633662/,Grilled Sweet Potatoes,9,2026-01-19 05:31:14
https://www.pinterest.com/pin/1075093742312612654/,Baked Potato Skins,9,2026-01-19 05:31:15
https://www.pinterest.com/pin/1075093742312180105/,Hot Honey Cream Cheese Dip,9,2026-01-19 05:31:34
https://www.pinterest.com/pin/1075093742312831956/,Brookies Cookies,9,2026-01-19 05:31:37
https://www.pinterest.com/pin/1075093742312102616/,Creamy Crockpot Chicken Piccata,9,2026-01-19 05:31:41
https://www.pinterest.com/pin/1075093742312540949/,Easy Sticky Chicken Tenders,9,2026-01-19 05:31:47
https://www.pinterest.com/pin/1075093742311968891/,Slow Cooker Italian Beef Sandwiches,9,2026-01-19 05:31:50
https://www.pinterest.com/pin/1075093742311625181/,No Bake Peanut Butter Pretzel Clusters,9,2026-01-19 05:31:59
https://www.pinterest.com/pin/1075093742311071042/,Chicken Street Tacos Recipe,9,2026-01-19 05:32:27
https://www.pinterest.com/pin/1075093742308681206/,Soft Pumpkin Chocolate Chip Cookies,9,2026-01-19 05:34:17
https://www.pinterest.com/pin/1075093742308676791/,Pumpkin Banana Chocolate Chip Muffins,9,2026-01-19 05:34:19
https://www.pinterest.com/pin/1075093742309187702/,Air Fryer Hot Honey Chicken Bites,9,2026-01-19 05:34:24
https://www.pinterest.com/pin/1075093742308511597/,Banh Mi Bowls,9,2026-01-19 05:34:30
https://www.pinterest.com/pin/1075093742308048546/,Deconstructed Stuffed Peppers,9,2026-01-19 05:34:47
https://www.pinterest.com/pin/1075093742307793466/,Easy Chicken Breast with Feta and Spinach,9,2026-01-19 05:35:00
https://www.pinterest.com/pin/1075093742307011784/,Pierogi Recipe,9,2026-01-19 05:35:37
https://www.pinterest.com/pin/1075093742306748985/,Peaches and Cream,9,2026-01-19 05:35:47
https://www.pinterest.com/pin/1075093742306733525/,Baked Caramel Apple Cheesecake Dip,9,2026-01-19 05:35:49
https://www.pinterest.com/pin/1075093742306086889/,Lemon Pepper Chicken Breasts or Thighs,9,2026-01-19 05:36:22
https://www.pinterest.com/pin/1075093742305795632/,Roasted Zucchini and Summer Squash,9,2026-01-19 05:36:37
https://www.pinterest.com/pin/1075093742305681994/,Apple Butter Cookies,9,2026-01-19 05:36:42
https://www.pinterest.com/pin/1075093742303663682/,Grilled Pineapple Chicken,9,2026-01-19 05:37:55
https://www.pinterest.com/pin/1075093742303498106/,Mediterranean Chicken Orzo,9,2026-01-19 05:38:04
https://www.pinterest.com/pin/1075093742303481241/,Butter Poached Lobster Tail,9,2026-01-19 05:38:06
https://www.pinterest.com/pin/baked-caesar-chicken-cooking-circuit--1075093742303431042/,Baked Caesar Chicken,9,2026-01-19 05:38:07
https://www.pinterest.com/pin/oreo-fluff-recipe-cooking-circuit--1075093742303278992/,Oreo Fluff Recipe,9,2026-01-19 05:38:14
https://www.pinterest.com/pin/1075093742302906851/,Simple Chicken Gyro Bowls,9,2026-01-19 05:38:33
https://www.pinterest.com/pin/1075093742302516401/,One-Pot Chicken and Orzo,9,2026-01-19 05:38:54
https://www.pinterest.com/pin/1075093742302479396/,Southwest Ground Beef and Sweet Potato Skillet,9,2026-01-19 05:38:58
https://www.pinterest.com/pin/1075093742301251596/,Parmesan Italian Sausage Soup,9,2026-01-19 05:40:16
https://www.pinterest.com/pin/dinner-recipes--1075093742299702026/,Gooey Mozzarella Biscuit Bombs Recipe,9,2026-01-19 05:40:36
https://www.pinterest.com/pin/bagel-breakfast-sliders-recipe-cooking-circuit--1075093742300037842/,Bagel Breakfast Sliders Recipe,9,2026-01-19 05:40:53
https://www.pinterest.com/pin/1075093742313196265/,Cardamom Plum Sorbet,8,2026-01-19 05:30:45
https://www.pinterest.com/pin/1075093742313019751/,Lazy Chicken Parmesan Grilled Cheese,8,2026-01-19 05:30:54
https://www.pinterest.com/pin/1075093742312954531/,Creamy Crockpot Crack Chicken,8,2026-01-19 05:30:57
https://www.pinterest.com/pin/1075093742312573797/,Crispy Brussel Sprouts With Dijon Aioli,8,2026-01-19 05:31:18
https://www.pinterest.com/pin/1075093742312435619/,Creamy Dijon Chicken and Potatoes,8,2026-01-19 05:31:24
https://www.pinterest.com/pin/1075093742311622470/,Crème Brûlée French Toast,8,2026-01-19 05:31:59
https://www.pinterest.com/pin/1075093742311619854/,Lemon Butter Scallops,8,2026-01-19 05:32:01
https://www.pinterest.com/pin/1075093742310915196/,Chocolate Chip Cheesecake Bars,8,2026-01-19 05:32:33
https://www.pinterest.com/pin/1075093742311371430/,Apple Crumble Cheesecake Recipe,8,2026-01-19 05:32:36
https://www.pinterest.com/pin/1075093742310841024/,Pumpkin Pie Brûlée with Bourbon Vanilla Whipped Cream,8,2026-01-19 05:32:38
https://www.pinterest.com/pin/1075093742310073731/,Stanley Tucci's Pasta Carbonara,8,2026-01-19 05:33:15
https://www.pinterest.com/pin/1075093742310881455/,Pumpkin Fudge,8,2026-01-19 05:33:32
https://www.pinterest.com/pin/1075093742309284328/,Sheet Pan Chicken and Potatoes Recipe,8,2026-01-19 05:33:54
https://www.pinterest.com/pin/1075093742309194619/,Sticky Tamarind Wings,8,2026-01-19 05:33:57
https://www.pinterest.com/pin/1075093742308357450/,Texas Roadhouse Chili Recipe,8,2026-01-19 05:34:37
https://www.pinterest.com/pin/1075093742308563370/,Broccoli Cauliflower Cheese Sausage,8,2026-01-19 05:34:51
https://www.pinterest.com/pin/1075093742307929451/,Marsala Chicken Orzo,8,2026-01-19 05:34:54
https://www.pinterest.com/pin/1075093742307462528/,Crockpot Marry Me Chicken Recipe,8,2026-01-19 05:35:19
