url,title,saves,timestamp
https://www.pinterest.com/pin/1075093742301455282/,Cheese and Sausage Biscuit Recipe,9279,2026-01-19 05:40:10
https://www.pinterest.com/pin/1075093742309136898/,Cranberry Goat Cheese Sourdough,7862,2026-01-19 05:33:59
https://www.pinterest.com/pin/1075093742301715412/,Mediterranean Chicken Zucchini Bake Recipe,5841,2026-01-19 05:39:48
https://www.pinterest.com/pin/1075093742301295147/,Homemade Reuben Bake Recipe,5582,2026-01-19 05:40:41
https://www.pinterest.com/pin/1075093742299820842/,Thai Style Sweet Chili Ribs Recipe,3252,2026-01-19 05:40:30
https://www.pinterest.com/pin/1075093742307506074/,Quick Ground Turkey Orzo Recipe,3029,2026-01-19 05:35:17
https://www.pinterest.com/pin/1075093742299523948/,Chicken Pot Pie Casserole Recipe,1949,2026-01-19 05:40:37
https://www.pinterest.com/pin/1075093742301221495/,Shepherds Pie Soup Recipe,1865,2026-01-19 05:40:18
https://www.pinterest.com/pin/1075093742308423719/,Vegetarian Lentil Soup,1792,2026-01-19 05:34:33
https://www.pinterest.com/pin/1075093742307642646/,Orzo Tuscan Chicken Bake,1765,2026-01-19 05:35:08
https://www.pinterest.com/pin/1075093742302300174/,Chicken and Sweet Potato Bowls for Two,1194,2026-01-19 05:40:07
https://www.pinterest.com/pin/1075093742307227772/,Cowboy Candy with Sweet and Spicy Jalapeños,1191,2026-01-19 05:35:56
https://www.pinterest.com/pin/1075093742308045614/,Sheet Pan Pineapple Chicken,1174,2026-01-19 05:34:49
https://www.pinterest.com/pin/1075093742303870783/,Sheet Pan Sticky Sweet and Sour Chicken,1138,2026-01-19 05:37:47
https://www.pinterest.com/pin/1075093742308868490/,Olive Garden Chicken Scampi,1076,2026-01-19 05:34:10
https://www.pinterest.com/pin/1075093742307483867/,One Pot Marry Me Chicken Pasta,1014,2026-01-19 05:35:17
https://www.pinterest.com/pin/1075093742305315834/,Sheet Pan Kielbasa Potatoes and Green Beans,889,2026-01-19 05:37:26
https://www.pinterest.com/pin/1075093742307164733/,Chicken Alfredo Orzo,827,2026-01-19 05:35:30
https://www.pinterest.com/pin/1075093742307483953/,One Pot Marry Me Chicken Pasta,810,2026-01-19 05:35:17
https://www.pinterest.com/pin/1075093742311641507/,Spicy Jalapeno Chicken with Creamy Sauce,699,2026-01-19 05:32:01
https://www.pinterest.com/pin/1075093742302483578/,Creamy Garlic Parmesan Orzo,644,2026-01-19 05:38:57
https://www.pinterest.com/pin/1075093742307405275/,Creamy Smothered Chicken and Rice,643,2026-01-19 05:35:21
https://www.pinterest.com/pin/1075093742306935813/,White Chicken Enchiladas Recipe,634,2026-01-19 05:35:42
https://www.pinterest.com/pin/1075093742308244848/,Roasted Vegetable and Chickpea Bowl,578,2026-01-19 05:34:41
https://www.pinterest.com/pin/1075093742302063076/,Baked Ranch Chicken Recipe,540,2026-01-19 05:39:24
https://www.pinterest.com/pin/1075093742301557346/,Mongolian Beef,512,2026-01-19 05:40:01
https://www.pinterest.com/pin/1075093742308298696/,Baked Cream Cheese Spaghetti Casserole,510,2026-01-19 05:35:07
https://www.pinterest.com/pin/1075093742311038093/,Savory Breakfast Pop-Tarts,487,2026-01-19 05:32:26
https://www.pinterest.com/pin/1075093742307523591/,Crockpot Chicken Broccoli and Rice Casserole,483,2026-01-19 05:35:16
https://www.pinterest.com/pin/1075093742307324270/,Spiced Pear Upside Down Cake Recipe,470,2026-01-19 05:35:24
https://www.pinterest.com/pin/1075093742306918635/,Slow Cooker Beef Manhattan,445,2026-01-19 05:35:42
https://www.pinterest.com/pin/1075093742306836276/,Chicken Parmesan Casserole,444,2026-01-19 05:35:44
https://www.pinterest.com/pin/1075093742308040365/,"Sheet Pan Roasted Sweet Potatoes, Sausage, and Broccoli",432,2026-01-19 05:34:48
https://www.pinterest.com/pin/1075093742299547920/,Pecan Pie Layer Cake Recipe,418,2026-01-19 05:40:35
https://www.pinterest.com/pin/1075093742308372583/,Hatch Green Chile Stew with Ground Beef,409,2026-01-19 05:34:36
https://www.pinterest.com/pin/1075093742307037865/,Sheet Pan Cashew Chicken,386,2026-01-19 05:35:36
https://www.pinterest.com/pin/1075093742301993057/,Breakfast Pigs in a Blanket Recipe,374,2026-01-19 05:39:26
https://www.pinterest.com/pin/1075093742301835890/,Chicken Pot Pie Casserole Recipe,371,2026-01-19 05:39:40
https://www.pinterest.com/pin/1075093742308269335/,Creamy Street Corn Pasta Salad,359,2026-01-19 05:34:40
https://www.pinterest.com/pin/1075093742310936084/,Giada's Braciole,333,2026-01-19 05:32:31
https://www.pinterest.com/pin/1075093742302609563/,Southwest Chicken Burrito Bowls,327,2026-01-19 05:38:47
https://www.pinterest.com/pin/1075093742301404414/,Mushroom Chicken Pasta,327,2026-01-19 05:40:11
https://www.pinterest.com/pin/1075093742311305561/,Soft and Chewy Ginger Snaps,320,2026-01-19 05:32:16
https://www.pinterest.com/pin/1075093742311435108/,Bobby Flay Paella Recipe,316,2026-01-19 05:32:30
https://www.pinterest.com/pin/1075093742308173905/,Easy Taco Casserole,312,2026-01-19 05:34:45
https://www.pinterest.com/pin/1075093742302057597/,Dump and Bake Chicken Tzatziki with Rice,311,2026-01-19 05:39:22
https://www.pinterest.com/pin/1075093742308427418/,Creamy Vegetarian Tortilla Soup,294,2026-01-19 05:34:33
https://www.pinterest.com/pin/1075093742301480555/,Chicken a la King,289,2026-01-19 05:40:03
https://www.pinterest.com/pin/1075093742306760181/,Ranch 7 Layer Salad,284,2026-01-19 05:35:48
https://www.pinterest.com/pin/1075093742300372851/,Breakfast Casserole with Biscuits and Gravy,284,2026-01-19 05:40:49
https://www.pinterest.com/pin/1075093742302585076/,Chorizo Breakfast Burritos with Potatoes and Eggs,282,2026-01-19 05:38:49
https://www.pinterest.com/pin/1075093742303125005/,Chicken and Rice Casserole Recipe,278,2026-01-19 05:38:49
https://www.pinterest.com/pin/1075093742308166756/,Hobo Casserole Rustic Ground Beef and Potato Bake,276,2026-01-19 05:34:45
https://www.pinterest.com/pin/1075093742307904215/,Lemon Pecorino Crusted Chicken with Creamy Lemon Sauce,274,2026-01-19 05:34:57
https://www.pinterest.com/pin/1075093742307134561/,Buffalo Chicken Roll Ups,262,2026-01-19 05:35:32
https://www.pinterest.com/pin/1075093742307773126/,Greek Chicken Orzo Bowls,252,2026-01-19 05:35:03
https://www.pinterest.com/pin/1075093742304575769/,Zucchini Casserole Recipe,250,2026-01-19 05:37:18
https://www.pinterest.com/pin/1075093742307022688/,Caramel Apple Upside-Down Cake,248,2026-01-19 05:35:58
https://www.pinterest.com/pin/1075093742308010741/,Lemon-Feta Chicken and Orzo,247,2026-01-19 05:35:14
https://www.pinterest.com/pin/1075093742311128140/,Million Dollar Ravioli Casserole,236,2026-01-19 05:32:24
https://www.pinterest.com/pin/1075093742308581176/,Homemade Vanilla Whipped Cream Recipe,231,2026-01-19 05:34:23
https://www.pinterest.com/pin/1075093742311204477/,Bangin' Breakfast Potatoes,228,2026-01-19 05:32:18
https://www.pinterest.com/pin/1075093742301677694/,Creamy Chicken and Broccoli Pasta,220,2026-01-19 05:39:51
https://www.pinterest.com/pin/1075093742301710980/,Firecracker Ground Chicken Bowls,215,2026-01-19 05:39:48
https://www.pinterest.com/pin/1075093742306882305/,Easy Peach Basil Balsamic Chicken,213,2026-01-19 05:35:43
https://www.pinterest.com/pin/1075093742305374938/,Sheet Pan Steak Fajitas,212,2026-01-19 05:36:59
https://www.pinterest.com/pin/1075093742302343117/,Creamy Tomato Basil Chicken,211,2026-01-19 05:39:07
https://www.pinterest.com/pin/1075093742304980598/,Baked Caprese Chicken,206,2026-01-19 05:37:16
https://www.pinterest.com/pin/1075093742307040324/,Sheet Pan Cajun Shrimp and Sausage Vegetable,203,2026-01-19 05:35:37
https://www.pinterest.com/pin/1075093742303735964/,Greek Lemon Chicken Bake,195,2026-01-19 05:38:19
https://www.pinterest.com/pin/1075093742310966618/,Toffee Chex Mix Recipe,193,2026-01-19 05:32:31
https://www.pinterest.com/pin/1075093742301640291/,Kielbasa Cowboy Beans,192,2026-01-19 05:39:52
https://www.pinterest.com/pin/1075093742302653291/,Sesame Ground Chicken,187,2026-01-19 05:38:46
https://www.pinterest.com/pin/1075093742308029917/,Crock Pot Tuscan Garlic Chicken,185,2026-01-19 05:35:14
https://www.pinterest.com/pin/1075093742308445388/,Slow Cooker Keto Chicken Cream Cheese Soup,184,2026-01-19 05:35:04
https://www.pinterest.com/pin/1075093742302690376/,"Greek Shrimp with Orzo, Feta, Olives, and Tomatoes",179,2026-01-19 05:38:42
https://www.pinterest.com/pin/1075093742308488745/,Sesame Chicken Meatball Bowls,177,2026-01-19 05:34:30
https://www.pinterest.com/pin/1075093742308495077/,Chicken and Vegetable Stir Fry Quinoa Bowls,176,2026-01-19 05:34:30
https://www.pinterest.com/pin/1075093742307635171/,One Pot Greek Chicken and Lemon Rice,175,2026-01-19 05:35:07
https://www.pinterest.com/pin/1075093742307966150/,Chicken Green Bean Stir Fry,175,2026-01-19 05:35:13
https://www.pinterest.com/pin/1075093742301521212/,Slow Cooker Beef Ramen Noodles,170,2026-01-19 05:40:02
https://www.pinterest.com/pin/1075093742312602166/,Slow Cooker Creamy Italian Chicken,168,2026-01-19 05:31:17
https://www.pinterest.com/pin/1075093742302614439/,Garlic Parmesan Roasted Brussels Sprouts,168,2026-01-19 05:38:47
https://www.pinterest.com/pin/1075093742302578838/,Maple Sausage Sweet Potato Hash,168,2026-01-19 05:38:51
https://www.pinterest.com/pin/1075093742310975324/,Buffalo Chicken Pasta,166,2026-01-19 05:32:32
https://www.pinterest.com/pin/1075093742311073299/,Creamy Chicken and Gnocchi,165,2026-01-19 05:32:25
https://www.pinterest.com/pin/1075093742307000851/,Best-Ever Baked Rigatoni,165,2026-01-19 05:35:38
https://www.pinterest.com/pin/1075093742307515681/,Million Dollar Chicken &amp; Rice Casserole,165,2026-01-19 05:36:13
https://www.pinterest.com/pin/1075093742307401325/,Food Court Bourbon Chicken Copycat Recipe,164,2026-01-19 05:35:24
https://www.pinterest.com/pin/1075093742301972153/,Egg and Ham Breakfast Sandwich Recipe,163,2026-01-19 05:39:28
https://www.pinterest.com/pin/1075093742301680699/,Beef and Pepper Rice Bowl,159,2026-01-19 05:39:49
https://www.pinterest.com/pin/1075093742308942883/,Texas Roadhouse Seasoned Rice,158,2026-01-19 05:34:41
https://www.pinterest.com/pin/1075093742302066785/,Condensed Milk Lemon Pie Recipe,151,2026-01-19 05:39:24
https://www.pinterest.com/pin/1075093742307447055/,Easy Crockpot Chicken and Rice,146,2026-01-19 05:35:19
https://www.pinterest.com/pin/1075093742307126441/,Chicken Jalapeño Popper Dip,145,2026-01-19 05:35:32
https://www.pinterest.com/pin/1075093742305564169/,Crack Chicken Casserole,144,2026-01-19 05:36:49
https://www.pinterest.com/pin/1075093742307465240/,Slow Cooker Chicken Burrito Bowls,139,2026-01-19 05:35:19
https://www.pinterest.com/pin/1075093742301915981/,Old Fashioned Pecan Pie Recipe,139,2026-01-19 05:39:31
https://www.pinterest.com/pin/1075093742307653982/,Whole Roasted Cauliflower with Spicy Sriracha Honey Glaze,135,2026-01-19 05:35:08
https://www.pinterest.com/pin/1075093742307674363/,Crock Pot Marry Me Chicken,134,2026-01-19 05:35:34
https://www.pinterest.com/pin/1075093742304993921/,Slow Cooker Kung Pao Chicken,133,2026-01-19 05:37:16
https://www.pinterest.com/pin/1075093742301291506/,Garlic Butter Chicken Bites with Creamy Parmesan Pasta,133,2026-01-19 05:40:14
https://www.pinterest.com/pin/1075093742307387824/,Panda Express Chow Mein,132,2026-01-19 05:35:23
https://www.pinterest.com/pin/1075093742307319695/,Baked Cream Cheese Chicken Taquitos,132,2026-01-19 05:35:24
https://www.pinterest.com/pin/1075093742301824052/,Dump and Bake Chicken Tzatziki with Rice,129,2026-01-19 05:39:40
https://www.pinterest.com/pin/1075093742312616346/,Slow Cooker BBQ Beef Brisket,128,2026-01-19 05:31:17
https://www.pinterest.com/pin/1075093742305129014/,Healthy Chicken &amp; Sweet Potato Rice Bowl,127,2026-01-19 05:37:33
https://www.pinterest.com/pin/1075093742311181339/,Gordon Ramsay Sticky Toffee Pudding,125,2026-01-19 05:32:21
https://www.pinterest.com/pin/one-pot-lemon-orzo-pasta-cooking-circuit--1075093742303095295/,One Pot Lemon Orzo pasta,125,2026-01-19 05:38:23
https://www.pinterest.com/pin/1075093742311155173/,Peppermint Christmas Float,124,2026-01-19 05:32:21
https://www.pinterest.com/pin/1075093742307138373/,Bisquick Chicken and Dumplings,123,2026-01-19 05:35:32
https://www.pinterest.com/pin/1075093742302732967/,One-Pot Tuscan Chicken Orzo,122,2026-01-19 05:38:41
https://www.pinterest.com/pin/root-vegetable-gratin-with-sweet-potatoes-parsnips-and-beets-cooking-circuit--1075093742302545736/,"Root Vegetable Gratin with Sweet Potatoes, Parsnips, and Beets",122,2026-01-19 05:38:54
https://www.pinterest.com/pin/1075093742303679294/,Crispy Baked Zucchini Chips,121,2026-01-19 05:37:54
https://www.pinterest.com/pin/1075093742303635198/,Strawberry Spinach Salad,121,2026-01-19 05:38:19
https://www.pinterest.com/pin/1075093742309209913/,Mouthwatering Chocolate Brownie Cake,120,2026-01-19 05:33:57
https://www.pinterest.com/pin/1075093742302560381/,Creamy Steak Pasta,120,2026-01-19 05:38:53
https://www.pinterest.com/pin/1075093742308710336/,Creamy Beef Stroganoff Casserole,115,2026-01-19 05:34:18
https://www.pinterest.com/pin/1075093742311976019/,Funeral Potatoes,113,2026-01-19 05:31:46
https://www.pinterest.com/pin/1075093742303631928/,Crock Pot Teriyaki Chicken Recipe,113,2026-01-19 05:38:00
https://www.pinterest.com/pin/1075093742311900546/,Crockpot Angel Chicken,110,2026-01-19 05:31:49
https://www.pinterest.com/pin/1075093742307094498/,King Ranch Chicken,109,2026-01-19 05:35:36
https://www.pinterest.com/pin/1075093742310891655/,Angel Hair Pasta,108,2026-01-19 05:32:35
https://www.pinterest.com/pin/1075093742302020844/,Breakfast Sausage Crescent Rolls,107,2026-01-19 05:39:25
https://www.pinterest.com/pin/1075093742306879872/,Creamy Lemon Garlic Chicken Pasta,106,2026-01-19 05:36:09
https://www.pinterest.com/pin/1075093742300334693/,Ham and Cheese Pinwheels – Delicious Puff Pastry Bites,103,2026-01-19 05:40:24
https://www.pinterest.com/pin/1075093742309271551/,Mouthwatering Cowboy Butter Chicken,102,2026-01-19 05:34:27
https://www.pinterest.com/pin/1075093742298811355/,Creamy Chicken and Rice Casserole Delight Recipe,101,2026-01-19 05:40:48
https://www.pinterest.com/pin/1075093742311923846/,Marry Me Butter Beans,99,2026-01-19 05:31:49
https://www.pinterest.com/pin/1075093742303541467/,One Pan Pineapple Teriyaki Chicken,97,2026-01-19 05:38:03
https://www.pinterest.com/pin/1075093742301990509/,Strawberry Pretzel Dessert Recipe,97,2026-01-19 05:39:27
https://www.pinterest.com/pin/1075093742308766180/,Rice a Roni Chicken Casserole,96,2026-01-19 05:34:14
https://www.pinterest.com/pin/1075093742309012283/,Creamy Cheesy Rice recipe,95,2026-01-19 05:34:05
https://www.pinterest.com/pin/1075093742312060484/,Longhorn Steakhouse Rice Pilaf Recipe,94,2026-01-19 05:31:43
https://www.pinterest.com/pin/1075093742308087408/,One Pot Gnocchi Chicken Pot Pie,93,2026-01-19 05:34:47
https://www.pinterest.com/pin/1075093742305220742/,Healthy Roasted Vegetable Orzo Recipe,93,2026-01-19 05:37:05
https://www.pinterest.com/pin/1075093742307900637/,Salmon Burrito Bowl,92,2026-01-19 05:34:56
https://www.pinterest.com/pin/1075093742307848248/,Ground Chicken Sweet Chili Noodles,92,2026-01-19 05:34:57
https://www.pinterest.com/pin/healthy-recipes-community--1075093742301517051/,Gooey Mozzarella Biscuit Bombs,92,2026-01-19 05:40:01
https://www.pinterest.com/pin/1075093742308804921/,Easy Dump and Go Crockpot,91,2026-01-19 05:34:14
https://www.pinterest.com/pin/1075093742301184523/,Oatmeal Pancakes,90,2026-01-19 05:40:18
https://www.pinterest.com/pin/1075093742311399146/,Ruth’s Chris Bread Pudding,89,2026-01-19 05:32:43
https://www.pinterest.com/pin/1075093742311136742/,Butterfinger Caramel Crunch Bars,87,2026-01-19 05:32:22
https://www.pinterest.com/pin/1075093742311141413/,Crack Breakfast Casserole,87,2026-01-19 05:32:49
https://www.pinterest.com/pin/1075093742306972129/,Dirty Rice Recipe,87,2026-01-19 05:35:39
https://www.pinterest.com/pin/apricot-honey-ham-recipe-cooking-circuit--1075093742301913225/,Apricot Honey Ham Recipe,87,2026-01-19 05:39:30
https://www.pinterest.com/pin/1075093742306838650/,Ground Beef and Zucchini Skillet,85,2026-01-19 05:35:43
https://www.pinterest.com/pin/1075093742305433521/,"Sheet Pan Honey Garlic Kielbasa, Potatoes, &amp; Broccoli",85,2026-01-19 05:36:56
https://www.pinterest.com/pin/1075093742302103773/,Crispy Parmesan Chicken with Garlic Cream Sauce,85,2026-01-19 05:39:19
https://www.pinterest.com/pin/1075093742301553650/,Creamy Ranch Chicken,85,2026-01-19 05:40:01
https://www.pinterest.com/pin/1075093742305408610/,Texas Roadhouse Country Fried Chicken,84,2026-01-19 05:36:57
https://www.pinterest.com/pin/1075093742301860551/,Turkey Tetrazzini,84,2026-01-19 05:39:36
https://www.pinterest.com/pin/1075093742306939245/,Super Easy Beer Cheese Dip,83,2026-01-19 05:36:09
https://www.pinterest.com/pin/1075093742305466888/,Crock Pot Bourbon Chicken,83,2026-01-19 05:36:53
https://www.pinterest.com/pin/1075093742308385171/,Spicy chorizo pumpkin soup,82,2026-01-19 05:34:37
https://www.pinterest.com/pin/english-muffin-breakfast-pizza-cooking-circuit--1075093742302549148/,English Muffin Breakfast Pizza,82,2026-01-19 05:38:54
https://www.pinterest.com/pin/1075093742299948170/,Cherry Pistachio Cheesecake Bars Recipe,82,2026-01-19 05:40:30
https://www.pinterest.com/pin/1075093742298797265/,Cheese and Sausage Biscuit Recipe,82,2026-01-19 05:40:49
https://www.pinterest.com/pin/1075093742308801232/,Creamy Garlic Chicken Recipe,80,2026-01-19 05:34:14
https://www.pinterest.com/pin/1075093742308998724/,Dump and Bake Chicken Alfredo Rice Casserole,80,2026-01-19 05:34:39
https://www.pinterest.com/pin/1075093742307508887/,Ground Beef and Rice Skillet,80,2026-01-19 05:35:17
https://www.pinterest.com/pin/1075093742307130695/,Buffalo Chicken Pinwheels,79,2026-01-19 05:35:32
https://www.pinterest.com/pin/1075093742308641512/,Ground Turkey and Rice Skillet,78,2026-01-19 05:34:21
https://www.pinterest.com/pin/1075093742302398557/,Easy Chicken Marsala,78,2026-01-19 05:40:07
https://www.pinterest.com/pin/1075093742307345723/,Pumpkin Spice Tiramisu Recipe,77,2026-01-19 05:35:24
https://www.pinterest.com/pin/1075093742304242783/,Cheesy Provolone Baked Chicken,77,2026-01-19 05:37:24
https://www.pinterest.com/pin/1075093742301335792/,Chicken Parmesan Grilled Cheese,77,2026-01-19 05:40:14
https://www.pinterest.com/pin/1075093742307705509/,Mediterranean Chicken and Orzo,75,2026-01-19 05:35:06
https://www.pinterest.com/pin/1075093742311174108/,Easy Butter Pecan Cookies,73,2026-01-19 05:32:22
https://www.pinterest.com/pin/1075093742308080876/,Lemon Garlic Butter Chicken and Green Beans,73,2026-01-19 05:35:20
https://www.pinterest.com/pin/1075093742305257217/,Creamy Swiss Chicken Bake,73,2026-01-19 05:37:29
https://www.pinterest.com/pin/1075093742308127095/,Easy Lasagna Soup Recipe,72,2026-01-19 05:34:45
https://www.pinterest.com/pin/1075093742303651386/,One Pot Chicken and Rice,72,2026-01-19 05:37:56
https://www.pinterest.com/pin/1075093742309504057/,Chicken and Stuffing Casserole,71,2026-01-19 05:33:45
https://www.pinterest.com/pin/1075093742304232914/,Lemon Garlic Orzo &amp; Broccoli Skillet With Sausage,71,2026-01-19 05:37:24
https://www.pinterest.com/pin/1075093742310917376/,Easy Pancake Casserole Recipe,70,2026-01-19 05:32:34
https://www.pinterest.com/pin/1075093742305387484/,Chicken and Biscuits Casserole,70,2026-01-19 05:36:57
https://www.pinterest.com/pin/1075093742309432489/,White Chocolate Cherry Skulls,68,2026-01-19 05:34:19
https://www.pinterest.com/pin/1075093742313322274/,Crab and Shrimp Seafood Bisque Recipe,67,2026-01-19 05:30:39
https://www.pinterest.com/pin/1075093742307064724/,Rotisserie Chicken Sandwich,67,2026-01-19 05:35:36
https://www.pinterest.com/pin/1075093742303385343/,Chicken Fajita Rice Bowl,67,2026-01-19 05:38:10
https://www.pinterest.com/pin/1075093742301745682/,Greek Chicken Bowls Recipe,67,2026-01-19 05:39:45
https://www.pinterest.com/pin/1075093742300271344/,Kielbasa Cowboy Beans Recipe,67,2026-01-19 05:40:26
https://www.pinterest.com/pin/1075093742307953114/,Ground Chicken Lettuce Wraps,66,2026-01-19 05:34:53
https://www.pinterest.com/pin/1075093742307590963/,Cheesy Chicken and Rice Green Bean Casserole,64,2026-01-19 05:35:10
https://www.pinterest.com/pin/1075093742306885165/,Easy Cajun Chicken and Rice Recipe,64,2026-01-19 05:35:43
https://www.pinterest.com/pin/1075093742306772244/,One Pot Cajun Chicken Alfredo,64,2026-01-19 05:35:48
https://www.pinterest.com/pin/1075093742307539262/,Chicken Sausage Stir-Fry with Vegetables,63,2026-01-19 05:35:13
https://www.pinterest.com/pin/1075093742299152922/,Roasted Potato Breakfast Casserole Recipe,63,2026-01-19 05:40:44
https://www.pinterest.com/pin/1075093742305380280/,Chicken Thigh Marinade,62,2026-01-19 05:36:58
https://www.pinterest.com/pin/1075093742307579954/,"Chicken Sausage, Pepper and Cauliflower Rice Skillet",61,2026-01-19 05:35:11
https://www.pinterest.com/pin/1075093742303213276/,Tuscan Chicken and Orzo Skillet,60,2026-01-19 05:38:19
https://www.pinterest.com/pin/1075093742307018874/,Death By Chocolate Poke Cake,59,2026-01-19 05:35:37
https://www.pinterest.com/pin/1075093742301719298/,Marry Me Chicken Pasta,59,2026-01-19 05:39:47
https://www.pinterest.com/pin/1075093742300502292/,Crockpot Pierogi Casserole with Kielbasa,59,2026-01-19 05:40:20
https://www.pinterest.com/pin/1075093742299747251/,Condensed Milk Lemon Pie Recipe,59,2026-01-19 05:40:33
https://www.pinterest.com/pin/1075093742312957859/,Slow Cooker Pasta e Fagioli Soup,58,2026-01-19 05:30:57
https://www.pinterest.com/pin/1075093742309042545/,Creamy Smothered Chicken and Rice Delight,58,2026-01-19 05:34:06
https://www.pinterest.com/pin/1075093742306117801/,Thai Basil Chicken,58,2026-01-19 05:36:22
https://www.pinterest.com/pin/1075093742312164042/,Italian Pasta with Garlic Olive Oil Sauce,57,2026-01-19 05:31:37
https://www.pinterest.com/pin/1075093742309179942/,Air Fryer Salt and Pepper Chicken,57,2026-01-19 05:33:59
https://www.pinterest.com/pin/1075093742307666501/,Caribbean Jerk Chicken Bowl,57,2026-01-19 05:35:08
https://www.pinterest.com/pin/1075093742306012838/,Chicken Broccoli Casserole,57,2026-01-19 05:36:25
https://www.pinterest.com/pin/chocolate-mousse-brownies-recipe-cooking-circuit--1075093742303392207/,Chocolate Mousse Brownies Recipe,57,2026-01-19 05:38:29
https://www.pinterest.com/pin/1075093742302127841/,One Skillet Greek Chicken and Orzo,57,2026-01-19 05:39:18
https://www.pinterest.com/pin/1075093742305311049/,Copycat Chipotle Burrito Bowl,56,2026-01-19 05:37:56
https://www.pinterest.com/pin/1075093742299903241/,Mongolian Beef Recipe,56,2026-01-19 05:40:54
https://www.pinterest.com/pin/1075093742312532314/,Creamy Beef and Shells,55,2026-01-19 05:31:20
https://www.pinterest.com/pin/1075093742306888995/,Creamy Garlic Spinach Tortellini with Sausage,55,2026-01-19 05:36:48
https://www.pinterest.com/pin/creamy-cottage-cheese-orzo-cooking-circuit--1075093742303257124/,Creamy Cottage Cheese Orzo,55,2026-01-19 05:38:15
https://www.pinterest.com/pin/1075093742309464167/,Chicken Francese with Easy Lemon Butter Sauce,54,2026-01-19 05:33:47
https://www.pinterest.com/pin/1075093742307100944/,Bang Bang Chicken Dip,54,2026-01-19 05:35:33
https://www.pinterest.com/pin/1075093742307561768/,Garlic Butter Chicken with Parmesan Rice,54,2026-01-19 05:35:39
https://www.pinterest.com/pin/1075093742306962133/,Easy Moo Goo Gai Pan Recipe,54,2026-01-19 05:35:41
https://www.pinterest.com/pin/butterscotch-chocolate-chip-cookies-cooking-circuit--1075093742303281508/,Butterscotch Chocolate Chip Cookies,53,2026-01-19 05:38:15
https://www.pinterest.com/pin/1075093742312675181/,Cheeseburger Tater Tot Casserole,52,2026-01-19 05:31:13
https://www.pinterest.com/pin/1075093742310314686/,Seafood Gratin Recipe,52,2026-01-19 05:33:03
https://www.pinterest.com/pin/1075093742305240035/,Cheesy Garlic Butter Mushroom Stuffed Chicken,52,2026-01-19 05:37:03
https://www.pinterest.com/pin/1075093742305208768/,Chicken Burrito Bowl,52,2026-01-19 05:37:06
https://www.pinterest.com/pin/1075093742307716279/,Creamy Parmesan Orzo with Chicken and Asparagus,50,2026-01-19 05:35:04
https://www.pinterest.com/pin/1075093742307701437/,The BEST Greek Chicken Meatballs,49,2026-01-19 05:35:06
https://www.pinterest.com/pin/1075093742306802862/,Grilled Honey Mustard Chicken,49,2026-01-19 05:35:47
https://www.pinterest.com/pin/1075093742302635805/,Savory Ground Turkey Zucchini Casserole,49,2026-01-19 05:38:45
https://www.pinterest.com/pin/1075093742312317230/,Cheesy Chicken Quinoa Casserole,48,2026-01-19 05:31:27
https://www.pinterest.com/pin/1075093742305813493/,Cheesy Zucchini Breadsticks,48,2026-01-19 05:36:37
https://www.pinterest.com/pin/1075093742303905164/,Honey Chipotle Chicken Bowls Recipe,48,2026-01-19 05:37:44
https://www.pinterest.com/pin/1075093742311269612/,Chilaquiles Breakfast Casserole,47,2026-01-19 05:32:16
https://www.pinterest.com/pin/1075093742310055968/,Cranberry Orange Breakfast Cake Recipe,47,2026-01-19 05:33:16
https://www.pinterest.com/pin/1075093742308181639/,Healthy Buffalo Ranch Baked Chicken Strips,47,2026-01-19 05:34:42
https://www.pinterest.com/pin/1075093742310725562/,CARAMEL CHOCOLATE CRUNCH BARS,46,2026-01-19 05:32:42
https://www.pinterest.com/pin/1075093742304192970/,BLT Chicken Salad Recipe,46,2026-01-19 05:37:28
https://www.pinterest.com/pin/1075093742309252183/,Ranch Chicken Enchiladas,45,2026-01-19 05:34:30
https://www.pinterest.com/pin/1075093742302647627/,Baked Zucchini and Cheese,45,2026-01-19 05:38:46
https://www.pinterest.com/pin/1075093742301298497/,Creamy Chicken and Rice Casserole Delight Recipe,45,2026-01-19 05:40:13
https://www.pinterest.com/pin/french-silk-brownies-recipe-cooking-circuit--1075093742300279763/,French Silk Brownies Recipe,45,2026-01-19 05:40:49
https://www.pinterest.com/pin/1075093742310766107/,Chicken Cordon Bleu Casserole,44,2026-01-19 05:32:40
