url,title,saves,upload_date,timestamp
https://www.pinterest.com/pin/1129559150329765080/,Achieve Perfect Prime Rib Roast Every Single Time,1,2025-11-30T19:08:12.000Z,2026-01-16 17:58:32
https://www.pinterest.com/pin/1129559150329730255/,Make This Hearty Beef Shepherd Pot Pie Comfort Food,1,2025-11-29T23:33:22.000Z,2026-01-16 17:58:32
https://www.pinterest.com/pin/1129559150329760328/,Amazing No-Bake White Chocolate Cheesecake With Fruit,1,2025-11-30T17:02:30.000Z,2026-01-16 17:58:32
https://www.pinterest.com/pin/1129559150329693991/,Flavorful Creamy Beef Dinner Made Quickly In 1 Pot,3,2025-11-29T03:59:20.000Z,2026-01-16 17:58:33
https://www.pinterest.com/pin/1129559150329717441/,Cheesecake Crescent Rolls Taste Like Summer Sunshine,1,2025-11-29T17:24:46.000Z,2026-01-16 17:58:34
https://www.pinterest.com/pin/1129559150329683107/,Make Delicious No Bake Cranberry Brie Bites Quickly,1,2025-11-28T21:30:09.000Z,2026-01-16 17:58:34
https://www.pinterest.com/pin/1129559150329672316/,Hearty Beef And Veggie Bake Makes Breakfast Simple,1,2025-11-28T17:03:54.000Z,2026-01-16 17:58:34
https://www.pinterest.com/pin/1129559150329677393/,Flavorful Asian Beef Sloppy Joes For Weeknights,2,2025-11-28T19:15:19.000Z,2026-01-16 17:58:34
https://www.pinterest.com/pin/1129559150329687173/,Perfect Salt Pepper Mini Hasselback Potatoes Recipe,5,2025-11-28T23:36:32.000Z,2026-01-16 17:58:34
https://www.pinterest.com/pin/1129559150329649988/,Make These Flavorful French Onion Beef Sausage Rolls,4,2025-11-28T03:57:35.000Z,2026-01-16 17:58:34
https://www.pinterest.com/pin/1129559150329646499/,Serving Up A Wonderful French Fry Board Recipe,4,2025-11-28T01:44:19.000Z,2026-01-16 17:58:34
https://www.pinterest.com/pin/1129559150329929131/,"Easy Holiday Charcuterie Board – Minutes | Recipe | Party food appetizers, Appetizer recipes, Quick appetizers",3,N/A,2026-01-16 17:58:35
https://www.pinterest.com/pin/1129559150329639685/,Make Fun Festive Christmas Tree Beef Pizza Tonight,1,2025-11-27T21:26:53.000Z,2026-01-16 17:58:36
https://www.pinterest.com/pin/1129559150329635180/,Make This Ground Beef Philly Cheesesteak Casserole,3,2025-11-27T19:09:16.000Z,2026-01-16 17:58:36
https://www.pinterest.com/pin/1129559150329608751/,Delicious Easy Pumpkin Bars For Your Next Gathering,3,2025-11-27T03:56:46.000Z,2026-01-16 17:58:37
https://www.pinterest.com/pin/1129559150329567210/,Get Juicy Tender Beef With This Prime Rib Recipe,3,2025-11-26T03:57:21.000Z,2026-01-16 17:58:37
https://www.pinterest.com/pin/1129559150329845422/,Soft Valentine Sugar Cookies Without Alcohol Recipes,3,2025-12-02T19:09:21.000Z,2026-01-16 17:58:37
https://www.pinterest.com/pin/1129559150329605238/,Sweet Savory Beef Fried Rice For A Weeknight Meal,3,2025-11-27T01:48:15.000Z,2026-01-16 17:58:37
https://www.pinterest.com/pin/1129559150329561254/,Make Comforting Cheesy Chicken Broccoli Stuffed Shells Tonight,2,2025-11-25T23:37:21.000Z,2026-01-16 17:58:37
https://www.pinterest.com/pin/1129559150329558247/,Make This Savory Beef Sausage Cream Cheese Breakfast Casserole,2,2025-11-25T21:25:21.000Z,2026-01-16 17:58:38
https://www.pinterest.com/pin/1129559150329770172/,"Churro Cheesecake Bites-Easy Sweet Treat | Recipe | Cheesecake bites, Cheesecake bites recipe, Easy desserts",1,N/A,2026-01-16 17:58:38
https://www.pinterest.com/pin/1129559150329553382/,Refreshing Homemade Mint Chocolate Chip Ice Cream Delight,8,2025-11-25T19:09:19.000Z,2026-01-16 17:58:38
https://www.pinterest.com/pin/1129559150329726276/,Holiday Deviled Eggs-Festive Party Appetizer | Opskrift,2,N/A,2026-01-16 17:58:39
https://www.pinterest.com/pin/1129559150329549700/,Comforting Chicken Beef Bacon Ranch Pasta Bake Dish,10,2025-11-25T17:02:56.000Z,2026-01-16 17:58:39
https://www.pinterest.com/pin/1129559150329529518/,Make Delicious No-Bake Oreo Cake Balls Quickly,25,2025-11-25T04:00:44.000Z,2026-01-16 17:58:40
https://www.pinterest.com/pin/1129559150329522295/,Creative Christmas Charcuterie Boards That Truly Impress,3,2025-11-24T23:33:15.000Z,2026-01-16 17:58:40
https://www.pinterest.com/pin/1129559150329525625/,Making Calabacitas Con Carne Salsa Verde Right,1,2025-11-25T01:52:22.000Z,2026-01-16 17:58:40
https://www.pinterest.com/pin/1129559150329518066/,Make Delicious Chicken Alfredo Calzones For Dinner Tonight,4,2025-11-24T21:25:21.000Z,2026-01-16 17:58:40
https://www.pinterest.com/pin/1129559150329513086/,Make Flavorful Mozzarella Pepperoni Croissant Rolls,3,2025-11-24T19:14:19.000Z,2026-01-16 17:58:40
https://www.pinterest.com/pin/1129559150329690162/,Chewy Maple Cinnamon White Chocolate Cookies | Opskrift,1,N/A,2026-01-16 17:58:40
https://www.pinterest.com/pin/1129559150329721551/,"Best Meat Lover’s Pizza Bread Recipe – Easy & Delicious | Recipe | Easy bread recipes, Pizza bread, Recipes",6,N/A,2026-01-16 17:58:40
https://www.pinterest.com/pin/1129559150329508416/,Authentic Avgolemono Greek Lemon Chicken Soup Made Well,1,2025-11-24T17:04:48.000Z,2026-01-16 17:58:41
https://www.pinterest.com/pin/1129559150329469220/,Make The Best Strawberry Crunch Cheesecake Dessert,1,2025-11-23T19:08:19.000Z,2026-01-16 17:58:41
https://www.pinterest.com/pin/1129559150329464039/,Make Fluffy Blueberry Scones With This Simple Recipe,7,2025-11-23T17:24:27.000Z,2026-01-16 17:58:41
https://www.pinterest.com/pin/1129559150329643812/,"Spicy Chile Relleno Burrito – Beef & Cheese Delight | Recipe | Stuffed peppers, Dinner, Savory",2,N/A,2026-01-16 17:58:41
https://www.pinterest.com/pin/1129559150329432355/,Cheesy Beef Taco Rice Skillet Meal Feels So Good,1,2025-11-22T23:40:20.000Z,2026-01-16 17:58:42
https://www.pinterest.com/pin/1129559150329435752/,Fudgy Banana Bread Brownies You Will Love Making,1,2025-11-23T01:50:18.000Z,2026-01-16 17:58:42
https://www.pinterest.com/pin/1129559150329439243/,Make Truly Decadent Double Chocolate Muffins,2,2025-11-23T03:59:09.000Z,2026-01-16 17:58:42
https://www.pinterest.com/pin/1129559150329421923/,Sweet Cheesecake Filling Makes Strawberries Delightful,2,2025-11-22T19:07:15.000Z,2026-01-16 17:58:43
https://www.pinterest.com/pin/1129559150329417834/,Irresistible Cookie Dough Brownie Bars Dessert Recipe,3,2025-11-22T17:25:21.000Z,2026-01-16 17:58:43
https://www.pinterest.com/pin/1129559150329426943/,Create Delicious Mini Heart Pizzas For Any Gathering,3,2025-11-22T21:21:14.000Z,2026-01-16 17:58:43
https://www.pinterest.com/pin/1129559150329393738/,Make This Decadent Caramel Cheesecake Slice Recipe,1,2025-11-22T03:56:48.000Z,2026-01-16 17:58:43
https://www.pinterest.com/pin/1129559150329343754/,Creamy Orange Creamsicle Pie Dessert You Can Make,4,2025-11-20T23:37:12.000Z,2026-01-16 17:58:43
https://www.pinterest.com/pin/1129559150329381550/,Making Delicious Beef Green Bean Bundles Taste Great,2,2025-11-21T21:21:15.000Z,2026-01-16 17:58:43
https://www.pinterest.com/pin/1129559150329630488/,Easy Beef and Egg Casserole- Quick Breakfast Favorite | Opskrift,1,N/A,2026-01-16 17:58:44
https://www.pinterest.com/pin/1129559150329333466/,Small Batch Pistachio Cream Rolls Taste Amazing,1,2025-11-20T19:09:15.000Z,2026-01-16 17:58:44
https://www.pinterest.com/pin/1129559150329338418/,Chewy Christmas Sprinkle Pudding Cookies Make Wonderful Holiday Bakes,1,2025-11-20T21:28:14.000Z,2026-01-16 17:58:44
https://www.pinterest.com/pin/1129559150329563967/,Sweet Mini Apple Pies Make Perfect Individual Desserts,3,2025-11-26T01:49:19.000Z,2026-01-16 17:58:44
https://www.pinterest.com/pin/1129559150329307035/,Festive Pomegranate Guacamole Cups Appetizer Idea,3,2025-11-20T03:58:07.000Z,2026-01-16 17:58:45
https://www.pinterest.com/pin/1129559150329304181/,Healthier Baked Orange Chicken With Crispy Skin,2,2025-11-20T01:48:14.000Z,2026-01-16 17:58:45
https://www.pinterest.com/pin/1129559150329329522/,Irresistible Pistachio Chocolate Cookies Are Truly Worth Making,38,2025-11-20T17:04:27.000Z,2026-01-16 17:58:45
https://www.pinterest.com/pin/1129559150329302065/,Delicious Spooky Halloween Brownies You Must Make,2,2025-11-20T00:36:19.000Z,2026-01-16 17:58:46
https://www.pinterest.com/pin/1129559150329287015/,Decadent Red Velvet Cinnamon Rolls You Should Bake,5,2025-11-19T17:00:54.000Z,2026-01-16 17:58:46
https://www.pinterest.com/pin/1129559150329296820/,Creamy Strawberry Crunch Cheesecake Making Experience,1,2025-11-19T21:22:16.000Z,2026-01-16 17:58:46
https://www.pinterest.com/pin/1129559150329292559/,Warm Comfort With This Simple Beef Tortellini Soup,2,2025-11-19T19:16:16.000Z,2026-01-16 17:58:46
https://www.pinterest.com/pin/1129559150329267151/,Flavorful Thai Red Beef Curry Soup You Will Crave,9,2025-11-19T03:55:51.000Z,2026-01-16 17:58:46
https://www.pinterest.com/pin/1129559150329264411/,Make This Cheeseburger Meatloaf Ultimate Comfort Food,44,2025-11-19T01:53:10.000Z,2026-01-16 17:58:46
https://www.pinterest.com/pin/1129559150329261234/,Delicious Valentine Strawberry Cookies Without Alcohol,1,2025-11-18T23:39:13.000Z,2026-01-16 17:58:47
https://www.pinterest.com/pin/1129559150329248391/,Comforting Beef Tortellini Soup Ready In Minutes,1,2025-11-18T17:04:48.000Z,2026-01-16 17:58:47
https://www.pinterest.com/pin/1129559150329252979/,Delicious Strawberry Cheesecake Dessert Tacos You Can Make,1,2025-11-18T19:16:20.000Z,2026-01-16 17:58:47
https://www.pinterest.com/pin/1129559150328198659/,Make the Best Comfort Food Shepherds Pie,3,2025-10-25T00:45:16.000Z,2026-01-16 17:58:48
https://www.pinterest.com/pin/1129559150328575676/,Make Amazing Mini Pineapple Cheesecakes Easily,1,2025-11-02T17:03:56.000Z,2026-01-16 17:58:48
https://www.pinterest.com/pin/1129559150328189775/,Make a Starbucks Strawberry Shortcake Frappuccino At Home,13,2025-10-24T20:23:09.000Z,2026-01-16 17:58:48
https://www.pinterest.com/pin/1129559150328184979/,Make Creamy Harissa Pasta With Sweet Potato,7,2025-10-24T18:13:14.000Z,2026-01-16 17:58:48
https://www.pinterest.com/pin/1129559150328180691/,Bake Easy and Delicious Pumpkin Cupcakes Right Now,8,2025-10-24T16:03:48.000Z,2026-01-16 17:58:48
https://www.pinterest.com/pin/1129559150328114091/,Make Sweet Creamy Blueberry Cheesecake Cookies,14,2025-10-23T00:44:13.000Z,2026-01-16 17:58:49
https://www.pinterest.com/pin/1129559150328110756/,Make Sweet Tangy Treats With Mini Cheesecakes,15,2025-10-22T22:36:08.000Z,2026-01-16 17:58:49
https://www.pinterest.com/pin/1129559150328107184/,Simple Crockpot Chicken And Potatoes Recipe Success,56,2025-10-22T20:27:11.000Z,2026-01-16 17:58:49
https://www.pinterest.com/pin/1129559150328096095/,Easy Basil Cream Sauce Chicken Dinner Tonight,15,2025-10-22T16:03:30.000Z,2026-01-16 17:58:50
https://www.pinterest.com/pin/1129559150328076491/,Make Easy Creamy Fudge For Autumn,1,2025-10-22T02:57:35.000Z,2026-01-16 17:58:50
https://www.pinterest.com/pin/1129559150328070380/,Make Your Own Sno Ball Brownies Recipe,1,2025-10-21T22:38:16.000Z,2026-01-16 17:58:50
https://www.pinterest.com/pin/1129559150329389593/,"Rainbow Krispies Treat-Easy Fun & Colorful Dessert | Recipe | Colorful desserts, Rice krispie treats, Krispie treats",5,N/A,2026-01-16 17:58:50
https://www.pinterest.com/pin/1129559150328073532/,Make Easy Mini Strawberry Crunch Bites Dessert,1,2025-10-22T00:50:19.000Z,2026-01-16 17:58:50
https://www.pinterest.com/pin/1129559150329385651/,Air Fryer Chicken Mozzarella Wraps – Crispy & Easy | Opskrift,1,N/A,2026-01-16 17:58:51
https://www.pinterest.com/pin/1129559150328066263/,Make Creamy Tangy Lime Mousse Cheesecake,1,2025-10-21T20:26:16.000Z,2026-01-16 17:58:51
https://www.pinterest.com/pin/1129559150328102812/,Make Easy Frozen Yogurt Peanut Butter Bites Fast,13,2025-10-22T18:10:11.000Z,2026-01-16 17:58:52
https://www.pinterest.com/pin/1129559150328057137/,Make Easy Savory Breakfast Crescent Roll Ups,3,2025-10-21T16:23:10.000Z,2026-01-16 17:58:52
https://www.pinterest.com/pin/1129559150328034898/,Make Irresistibly Fluffy Japanese Souffle Pancakes,6,2025-10-21T02:55:51.000Z,2026-01-16 17:58:52
https://www.pinterest.com/pin/1129559150327999361/,Make Sweet Moist Hawaiian Pineapple Carrot Muffins,31,2025-10-20T02:56:22.000Z,2026-01-16 17:58:53
https://www.pinterest.com/pin/1129559150328017538/,Make This Sweet Smoky Honey BBQ Chicken Dinner,12,2025-10-20T16:22:34.000Z,2026-01-16 17:58:53
https://www.pinterest.com/pin/1129559150327996013/,Make Healthy Grilled Salmon With Fresh Lemon,1,2025-10-20T00:49:18.000Z,2026-01-16 17:58:53
https://www.pinterest.com/pin/1129559150329256922/,Festive Holiday Appetizers For Your Best Party Ever | Opskrift,1,N/A,2026-01-16 17:58:54
https://www.pinterest.com/pin/1129559150327982484/,Make This Simple Feta Avocado Salad For Lunch,1,2025-10-19T18:08:13.000Z,2026-01-16 17:58:54
https://www.pinterest.com/pin/1129559150327978266/,Make Truly Decadent Chocolate Fudge Cupcakes,7,2025-10-19T16:23:14.000Z,2026-01-16 17:58:54
https://www.pinterest.com/pin/1129559150328151679/,Delicious Philly Cheesesteak Casserole: Beefy & Cheesy! | Opskrift,1,N/A,2026-01-16 17:58:54
https://www.pinterest.com/pin/1129559150328155119/,"Lemon Poppy Seed Cupcakes: Sweet, Zesty & Irresistible! | Recipe | Cupcake recipes, Easy baking, Desserts",5,N/A,2026-01-16 17:58:55
https://www.pinterest.com/pin/1129559150327950381/,Make Perfect Easy French Dip Sliders Fast,1,2025-10-19T00:43:13.000Z,2026-01-16 17:58:55
https://www.pinterest.com/pin/1129559150327947950/,Make Comforting Cheddar Garlic Herb Potato Soup,3,2025-10-18T22:38:14.000Z,2026-01-16 17:58:55
https://www.pinterest.com/pin/1129559150328158302/,"Classic Southern Fried Apples – A Sweet, Comforting Treat! | Recipe | Fried apples, Fried apples recipe easy, Southern fried apples recipe",88,N/A,2026-01-16 17:58:55
https://www.pinterest.com/pin/1129559150327942651/,Make Your Best Jambalaya Recipe Without Mushy Rice,20,2025-10-18T20:24:13.000Z,2026-01-16 17:58:56
https://www.pinterest.com/pin/1129559150327937278/,Make Creamy Pesto Pasta With Chicken Fast,17,2025-10-18T18:10:15.000Z,2026-01-16 17:58:56
https://www.pinterest.com/pin/1129559150327908798/,Make Bobby Flay Chicken Thighs Taste Amazing,30,2025-10-18T02:57:34.000Z,2026-01-16 17:58:56
https://www.pinterest.com/pin/1129559150327901194/,Make Moist Chocolate Banana Bread Your New Favorite,21,2025-10-17T22:32:26.000Z,2026-01-16 17:58:57
https://www.pinterest.com/pin/1129559150327897102/,Make This Sweet Tangy Pineapple Cheesecake Treat,2,2025-10-17T20:42:38.000Z,2026-01-16 17:58:57
https://www.pinterest.com/pin/1129559150327864845/,Make This Best Creamy Tortellini Soup Recipe,1,2025-10-17T02:58:30.000Z,2026-01-16 17:58:57
https://www.pinterest.com/pin/1129559150327892680/,Best Pumpkin Cheesecake Cookies Taste So Good,3,2025-10-17T18:35:36.000Z,2026-01-16 17:58:57
https://www.pinterest.com/pin/1129559150327887887/,Make These Delicious Peach Cobbler Twinkies Fast,4,2025-10-17T16:07:41.000Z,2026-01-16 17:58:57
https://www.pinterest.com/pin/1129559150328061025/,"Best Classic Butter Cookies: Simple, Rich & Melt-in-Your-Mouth | Recipe | Butter cookie recipe easy, Butter cookies easy, Butter cookies recipe",53,N/A,2026-01-16 17:58:58
https://www.pinterest.com/pin/1129559150327854047/,Make Easy Homemade Texas Roadhouse Butter Chicken Skillet,2,2025-10-16T20:28:27.000Z,2026-01-16 17:58:58
https://www.pinterest.com/pin/1129559150327858551/,Make Quick Healthy Flavorful Chicken Veggie Stir Fry,12,2025-10-16T22:51:32.000Z,2026-01-16 17:58:58
https://www.pinterest.com/pin/1129559150327848995/,Make Easy No Bake Oreo Cheesecake Sprinkles,0,2025-10-16T18:09:32.000Z,2026-01-16 17:58:59
https://www.pinterest.com/pin/1129559150327808626/,Make Best Easy Cream Cheese Squares Recipe,1,2025-10-15T18:08:55.000Z,2026-01-16 17:59:00
https://www.pinterest.com/pin/1129559150327812920/,Make Easy Delicious Pigs In A Blanket Appetizer,0,2025-10-15T20:27:24.000Z,2026-01-16 17:59:00
https://www.pinterest.com/pin/1129559150327778623/,Make Quick Healthy Sesame Chicken Tonight,1,2025-10-15T00:46:13.000Z,2026-01-16 17:59:00
https://www.pinterest.com/pin/1129559150327987424/,"Spicy Cajun White Chicken Chili – Your New Favorite Meal! | Recipe | White chili chicken recipe, Spicy recipes, Beef recipe instant pot",316,N/A,2026-01-16 17:59:00
https://www.pinterest.com/pin/1129559150327953310/,"Easy Peanut Butter Sandwich Cookies: Soft, Sweet & Delicious! | Recipe | Peanut butter sandwich cookie recipe, Sandwich cookies, Peanut butter sandwich cookies",12,N/A,2026-01-16 17:59:01
https://www.pinterest.com/pin/1129559150327992301/,"Chicken Beef Bacon Ranch Pasta: A Family Favorite! | Recipe | Chicken bacon ranch pasta, Ranch pasta, Chicken recipes",2,N/A,2026-01-16 17:59:01
https://www.pinterest.com/pin/1129559150327765324/,Make This Amazing Tater Tot Casserole Recipe,19,2025-10-14T18:10:26.000Z,2026-01-16 17:59:01
https://www.pinterest.com/pin/1129559150327769933/,Make Grandma's Classic Creamy Rice Pudding Sweet,164,2025-10-14T20:24:26.000Z,2026-01-16 17:59:01
https://www.pinterest.com/pin/1129559150327931532/,"Loaded Smashed Potatoes: Ultimate Cheesy Beef Bacon Delight! | Recipe | Smashed potatoes, Baked potato recipes, Smashed potatoes recipe",9,N/A,2026-01-16 17:59:02
https://www.pinterest.com/pin/1129559150327760658/,Make This Apple Crisp Cheesecake Dessert You Love,28,2025-10-14T16:14:09.000Z,2026-01-16 17:59:02
https://www.pinterest.com/pin/1129559150327732604/,Make The Best Grilled Salmon Simple And Healthy,5,2025-10-13T22:38:17.000Z,2026-01-16 17:59:03
https://www.pinterest.com/pin/1129559150327739755/,Make Festive Chocolate Chip Cookies That Taste Amazing,2,2025-10-14T03:04:43.000Z,2026-01-16 17:59:03
https://www.pinterest.com/pin/1129559150327736028/,Make Easy Chocolate Strawberry Yogurt Clusters Fast,5,2025-10-14T00:58:11.000Z,2026-01-16 17:59:03
https://www.pinterest.com/pin/1129559150327905551/,"Healthy BBQ Chicken Cottage Cheese Bowl | Protein Packed | Recipe | Air fryer recipes healthy, Healthier bbq, Meals",19,N/A,2026-01-16 17:59:03
https://www.pinterest.com/pin/1129559150327674419/,Make Rich Chewy Black Forest Brownies Easily,1,2025-10-12T17:17:49.000Z,2026-01-16 17:59:04
https://www.pinterest.com/pin/1129559150327643863/,Make Delicious Chicken Piccata That Tastes Restaurant Quality,115,2025-10-12T00:46:27.000Z,2026-01-16 17:59:04
https://www.pinterest.com/pin/1129559150327640538/,Make Easy No-Bake Butterfinger Candy Balls,15,2025-10-11T22:36:11.000Z,2026-01-16 17:59:04
https://www.pinterest.com/pin/1129559150327861227/,Make Easy Baked Orange Chicken Sweet and Tangy,75,2025-10-17T00:48:45.000Z,2026-01-16 17:59:04
https://www.pinterest.com/pin/1129559150327681929/,Make This Rich Chocolate Hazelnut Cake Recipe,1,2025-10-12T20:25:59.000Z,2026-01-16 17:59:05
https://www.pinterest.com/pin/1129559150327636692/,Make The Best Cheesy Garlic Bread Ever,29,2025-10-11T20:22:09.000Z,2026-01-16 17:59:05
https://www.pinterest.com/pin/1129559150327630675/,Make Flavorful Honey BBQ Chicken Rice Dinner,1,2025-10-11T18:07:25.000Z,2026-01-16 17:59:05
https://www.pinterest.com/pin/1129559150327624936/,Make Mary Berry Dijon Chicken For Dinner,2,2025-10-11T16:04:19.000Z,2026-01-16 17:59:05
https://www.pinterest.com/pin/1129559150327647018/,Make This Simple Vegan Peach Coffee Cake,1,2025-10-12T02:57:17.000Z,2026-01-16 17:59:05
https://www.pinterest.com/pin/1129559150327597775/,Make Comfort Food Creamy Mushroom Herb Casserole,1,2025-10-11T00:50:20.000Z,2026-01-16 17:59:06
https://www.pinterest.com/pin/1129559150327590029/,Make Crispy Zesty Hot Italian Beef Wraps Fast,1,2025-10-10T20:25:09.000Z,2026-01-16 17:59:06
https://www.pinterest.com/pin/1129559150327782217/,"Healthy Teriyaki Salmon Rice Bowls | Quick Meal Prep | Recipe | Salmon recipes, Teriyaki salmon, Real food recipes",2,N/A,2026-01-16 17:59:06
https://www.pinterest.com/pin/1129559150327585402/,Make Delicious Creamy Chicken Garlic Parmesan Pasta,5,2025-10-10T18:07:29.000Z,2026-01-16 17:59:06
https://www.pinterest.com/pin/1129559150327581204/,Make The Ultimate Creamy Cheesy Baked Ziti,1,2025-10-10T16:10:19.000Z,2026-01-16 17:59:06
https://www.pinterest.com/pin/1129559150325562554/,healthy diet meal,1,2025-08-25T00:15:06.000Z,2026-01-16 17:59:07
https://www.pinterest.com/pin/1129559150325562472/,healthy and delcious meals,2,2025-08-25T00:12:48.000Z,2026-01-16 17:59:08
https://www.pinterest.com/pin/1129559150327804025/,Make Roasted Zucchini And Yellow Squash Simply,46,2025-10-15T16:15:54.000Z,2026-01-16 17:59:08
https://www.pinterest.com/pin/1129559150327774285/,"Rich Creamy Beef Meatball Soup: Ultimate Comfort Food | Recipe | Meatball dinner, Comfort food, Meatball soup recipes",7,N/A,2026-01-16 17:59:08
https://www.pinterest.com/pin/1129559150325562526/,healthy and delicious dishes,5,2025-08-25T00:14:16.000Z,2026-01-16 17:59:08
https://www.pinterest.com/pin/1129559150327593913/,Easy Fettuccine Alfredo Recipe – Creamy Pasta in Minutes | Opskrift,1,N/A,2026-01-16 17:59:09
https://www.pinterest.com/pin/1129559150327600861/,Make Easy Cheesy Ground Beef Pasta Skillet Dinner,1,2025-10-11T02:56:57.000Z,2026-01-16 17:59:09
