url,title,saves,timestamp
https://www.pinterest.com/pin/1075093742310777946/,Italian Sausage With Bow Tie Pasta,1,2026-01-19 05:32:39
https://www.pinterest.com/pin/1075093742310810641/,Smoked Brisket &amp; Beer Cheese Pretzel Bombs,1,2026-01-19 05:32:39
https://www.pinterest.com/pin/1075093742310769784/,Salted Honey Pie,1,2026-01-19 05:32:39
https://www.pinterest.com/pin/1075093742310774012/,Crispiest Air Fryer Gnocchi,1,2026-01-19 05:32:39
https://www.pinterest.com/pin/1075093742310795504/,Pumpkin Cream Cheese Bread,1,2026-01-19 05:32:39
https://www.pinterest.com/pin/1075093742310801440/,Christmas Crack,1,2026-01-19 05:32:39
https://www.pinterest.com/pin/1075093742310736514/,Cowboy Mushrooms,1,2026-01-19 05:32:40
https://www.pinterest.com/pin/1075093742310805817/,Raspberry Swirl Brioche Loaf Recipe,1,2026-01-19 05:32:40
https://www.pinterest.com/pin/1075093742310732552/,Cheesy Cajun Garlic Chicken Rotini Skillet Recipe,1,2026-01-19 05:32:40
https://www.pinterest.com/pin/1075093742310789891/,Easy Cucumber Caprese Salad,1,2026-01-19 05:32:40
https://www.pinterest.com/pin/1075093742310798491/,Christmas Tree Focaccia,1,2026-01-19 05:32:40
https://www.pinterest.com/pin/1075093742310723027/,Toasted Ravioli in Air Fryer or Oven,1,2026-01-19 05:32:42
https://www.pinterest.com/pin/1075093742310699841/,Gooey Coffee Caramel Cake,1,2026-01-19 05:32:43
https://www.pinterest.com/pin/1075093742310679312/,Oatmeal Cream Pies,1,2026-01-19 05:32:43
https://www.pinterest.com/pin/1075093742310703240/,Outrageously Delicious Greek Moussaka,1,2026-01-19 05:32:43
https://www.pinterest.com/pin/1075093742310681278/,Cheesy Beef Enchiladas Tortellini,1,2026-01-19 05:32:43
https://www.pinterest.com/pin/1075093742310660136/,Pioneer Woman Quiche,1,2026-01-19 05:32:43
https://www.pinterest.com/pin/1075093742310663975/,Ina Garten Stuffed Manicotti,1,2026-01-19 05:32:43
https://www.pinterest.com/pin/1075093742310652987/,Roasted Red Pepper &amp; Mozzarella Stuffed Chicken,1,2026-01-19 05:32:44
https://www.pinterest.com/pin/1075093742310667687/,Baklava Cream Sandwich Cookies,1,2026-01-19 05:32:44
https://www.pinterest.com/pin/1075093742310649896/,Creamy Shrimp Fettuccine Pasta,1,2026-01-19 05:32:44
https://www.pinterest.com/pin/1075093742310656251/,Turkey &amp; Cranberry Sausage Rolls,1,2026-01-19 05:32:45
https://www.pinterest.com/pin/1075093742310647426/,Country Ranch Green Beans and Potatoes with Beef Recipe,1,2026-01-19 05:32:45
https://www.pinterest.com/pin/1075093742310645084/,Apple Pie Recipe,1,2026-01-19 05:32:45
https://www.pinterest.com/pin/1075093742310626959/,Baked Brie with Fig Jam and Pecans,1,2026-01-19 05:32:46
https://www.pinterest.com/pin/1075093742310622979/,Vanilla French Beignets Recipe,1,2026-01-19 05:32:46
https://www.pinterest.com/pin/1075093742310619026/,Mini Cannoli Cups,1,2026-01-19 05:32:46
https://www.pinterest.com/pin/1075093742310615374/,Chicken &amp; Dumplings Recipe,1,2026-01-19 05:32:47
https://www.pinterest.com/pin/1075093742310590809/,Easy Biscuits &amp; Gravy Casserole,1,2026-01-19 05:32:48
https://www.pinterest.com/pin/1075093742310594289/,Dolly's Chicken and Stuffing Casserole,1,2026-01-19 05:32:48
https://www.pinterest.com/pin/1075093742310552086/,Hot Cocoa Cookies,1,2026-01-19 05:32:48
https://www.pinterest.com/pin/1075093742310556684/,Ruths Chris Corn Pudding Recipe,1,2026-01-19 05:32:48
https://www.pinterest.com/pin/1075093742310606941/,Cinnamon Sugar Snowball Cookies,1,2026-01-19 05:32:48
https://www.pinterest.com/pin/1075093742310610803/,Cheesy Ground Beef Enchiladas,1,2026-01-19 05:32:49
https://www.pinterest.com/pin/1075093742310612778/,No Bake Pumpkin Cheesecake,1,2026-01-19 05:32:50
https://www.pinterest.com/pin/1075093742310568388/,Chicken Bell Pepper Ranch Burritos,1,2026-01-19 05:32:50
https://www.pinterest.com/pin/1075093742310543713/,Joanna Gaines Eggs Benedict Casserole,1,2026-01-19 05:32:50
https://www.pinterest.com/pin/1075093742310528604/,Gourmet Seafood Cassolette,1,2026-01-19 05:32:51
https://www.pinterest.com/pin/1075093742310533738/,Cake Batter Cookies Copycat,1,2026-01-19 05:32:51
https://www.pinterest.com/pin/1075093742310531561/,Rotel Cream Cheese Sausage Balls,1,2026-01-19 05:32:51
https://www.pinterest.com/pin/1075093742310518653/,Meatballs With Tzatziki,1,2026-01-19 05:32:51
https://www.pinterest.com/pin/1075093742310536669/,Creamy Buffalo Chicken Cauliflower Casserole Recipe,1,2026-01-19 05:32:52
https://www.pinterest.com/pin/1075093742310498937/,Potato and Sausage Chowder,1,2026-01-19 05:32:52
https://www.pinterest.com/pin/1075093742310496241/,Creamy Parmesan Garlic Beef Bowtie Pasta,1,2026-01-19 05:32:52
https://www.pinterest.com/pin/1075093742310493634/,Magic Cookie Bars from Eagle Brand,1,2026-01-19 05:32:53
https://www.pinterest.com/pin/1075093742310478599/,Snickerdoodle Pumpkin Bread,1,2026-01-19 05:32:53
https://www.pinterest.com/pin/1075093742310459229/,Creamy Lemon Garlic Pasta Recipe,1,2026-01-19 05:32:54
https://www.pinterest.com/pin/1075093742310470201/,Cashew Chicken Recipe,1,2026-01-19 05:32:54
https://www.pinterest.com/pin/1075093742310430922/,Million Dollar Lasagna Recipe,1,2026-01-19 05:32:55
https://www.pinterest.com/pin/1075093742310474567/,Little Debbie Christmas Tree Cake Truffles,1,2026-01-19 05:32:55
https://www.pinterest.com/pin/1075093742310482474/,Tasty Baked Breakfast Tacos,1,2026-01-19 05:32:55
https://www.pinterest.com/pin/1075093742310467020/,Cranberry and Turkey Stuffing Balls,1,2026-01-19 05:32:55
https://www.pinterest.com/pin/1075093742310423332/,Cannoli Cookies,1,2026-01-19 05:32:57
https://www.pinterest.com/pin/1075093742310408368/,Sun-Dried Tomato Pasta,1,2026-01-19 05:32:57
https://www.pinterest.com/pin/1075093742310421200/,Homemade Peppermint Patties Recipe,1,2026-01-19 05:32:57
https://www.pinterest.com/pin/1075093742310425873/,Sausage Egg and Cheese Breakfast Sliders,1,2026-01-19 05:32:58
https://www.pinterest.com/pin/1075093742310387128/,Jerk Chicken &amp; Mango Slaw Bowls with Honey Lime Cream,1,2026-01-19 05:32:59
https://www.pinterest.com/pin/1075093742310389028/,Pumpkin French Toast Breakfast,1,2026-01-19 05:32:59
https://www.pinterest.com/pin/1075093742310375373/,The Bear Spaghetti,1,2026-01-19 05:33:00
https://www.pinterest.com/pin/1075093742310359907/,Green Bean Casserole,1,2026-01-19 05:33:01
https://www.pinterest.com/pin/1075093742310350130/,Marinara Sauce Reecipe,1,2026-01-19 05:33:02
https://www.pinterest.com/pin/1075093742310312480/,Pancake Sausage Casserole,1,2026-01-19 05:33:02
https://www.pinterest.com/pin/1075093742310278454/,Snickers Fudge Recipe,1,2026-01-19 05:33:04
https://www.pinterest.com/pin/1075093742310247812/,Spicy Italian Sausage and Tortellini Soup,1,2026-01-19 05:33:05
https://www.pinterest.com/pin/1075093742310240812/,Apple Fritter Waffle Donuts Recipe,1,2026-01-19 05:33:05
https://www.pinterest.com/pin/1075093742310238254/,Pineapple Upside Down Cookies,1,2026-01-19 05:33:05
https://www.pinterest.com/pin/1075093742310792587/,Irresistible Thai Peanut Chicken,1,2026-01-19 05:33:05
https://www.pinterest.com/pin/1075093742310244070/,Heavenly Cake Mix Toffee Bars,1,2026-01-19 05:33:06
https://www.pinterest.com/pin/1075093742310275719/,Brown Sugar Pineapple Ham,1,2026-01-19 05:33:06
https://www.pinterest.com/pin/1075093742310233682/,Sticky Honey Garlic Sausage Pasta Skillet,1,2026-01-19 05:33:07
https://www.pinterest.com/pin/1075093742310235616/,Cranberry BBQ Crockpot Meatballs,1,2026-01-19 05:33:07
https://www.pinterest.com/pin/1075093742310212612/,Dolly Parton's Butterscotch Pie,1,2026-01-19 05:33:07
https://www.pinterest.com/pin/1075093742310216122/,Pigs in a Blanket,1,2026-01-19 05:33:08
https://www.pinterest.com/pin/1075093742310219500/,Soft Pumpkin Rolls Recipe,1,2026-01-19 05:33:08
https://www.pinterest.com/pin/1075093742310175954/,M&amp;M's Marshmallow Dream Bars,1,2026-01-19 05:33:09
https://www.pinterest.com/pin/1075093742310222800/,Crack Breakfast Sliders,1,2026-01-19 05:33:09
https://www.pinterest.com/pin/1075093742310179750/,Southern Fried Chicken and Waffles recipe,1,2026-01-19 05:33:09
https://www.pinterest.com/pin/1075093742310161914/,Chicken Fajita Casserole Recipe,1,2026-01-19 05:33:09
https://www.pinterest.com/pin/1075093742310172498/,Lo Mein Noodles,1,2026-01-19 05:33:09
https://www.pinterest.com/pin/1075093742310718507/,Reuben Balls with Spicy Thousand Island Dipping Sauce,1,2026-01-19 05:33:10
https://www.pinterest.com/pin/1075093742310166456/,Honey Pepper Chicken Panini Pasta,1,2026-01-19 05:33:10
https://www.pinterest.com/pin/1075093742310146342/,Creamy Red Pepper Pasta Sauce,1,2026-01-19 05:33:10
https://www.pinterest.com/pin/1075093742310142661/,Pumpkin Baked Oatmeal,1,2026-01-19 05:33:10
https://www.pinterest.com/pin/1075093742310150099/,Fiesta Lime Chicken Recipe,1,2026-01-19 05:33:11
https://www.pinterest.com/pin/1075093742310135900/,Eggs Benedict Quiche with Hollandaise Sauce,1,2026-01-19 05:33:11
https://www.pinterest.com/pin/1075093742310124728/,Orange Chicken Recipe,1,2026-01-19 05:33:11
https://www.pinterest.com/pin/1075093742310643169/,Christmas Tree Cake Truffles,1,2026-01-19 05:33:11
https://www.pinterest.com/pin/1075093742310126930/,Savory Christmas Cranberry Roll Ups,1,2026-01-19 05:33:12
https://www.pinterest.com/pin/1075093742310132365/,Italian Crescent Roll Sandwich Bake,1,2026-01-19 05:33:12
https://www.pinterest.com/pin/1075093742310112428/,Slow Cooker Santa Fe Chicken,1,2026-01-19 05:33:13
https://www.pinterest.com/pin/1075093742310105654/,Pumpkin French Toast Casserole,1,2026-01-19 05:33:13
https://www.pinterest.com/pin/1075093742310107203/,White Chocolate Lemon Raspberry Cookies,1,2026-01-19 05:33:13
https://www.pinterest.com/pin/1075093742310109339/,Gordon Ramsay Ground Turkey Pasta Recipe,1,2026-01-19 05:33:13
https://www.pinterest.com/pin/1075093742310102875/,Pecan Pie Lasagna,1,2026-01-19 05:33:13
https://www.pinterest.com/pin/1075093742310099941/,Croissant French Toast Casserole Recipe,1,2026-01-19 05:33:14
https://www.pinterest.com/pin/1075093742310069720/,Cherry Pie Bites,1,2026-01-19 05:33:14
https://www.pinterest.com/pin/1075093742310062076/,Rotel Pasta Recipe,1,2026-01-19 05:33:14
https://www.pinterest.com/pin/1075093742310097935/,No Bake Peanut Butter Balls with Rice,1,2026-01-19 05:33:14
https://www.pinterest.com/pin/1075093742310058868/,Slow Cooker Lasagna Soup,1,2026-01-19 05:33:15
https://www.pinterest.com/pin/1075093742310040886/,Overnight Croissant Breakfast Casserole,1,2026-01-19 05:33:15
https://www.pinterest.com/pin/1075093742310052757/,Creamy Scalloped Potatoes,1,2026-01-19 05:33:16
https://www.pinterest.com/pin/1075093742310003280/,Baked Egg Casserole Breakfast Recipe,1,2026-01-19 05:33:16
https://www.pinterest.com/pin/1075093742310028808/,Double Strawberry Sugar Cookies,1,2026-01-19 05:33:16
https://www.pinterest.com/pin/1075093742310033053/,Creamy Sausage Rigatoni,1,2026-01-19 05:33:16
https://www.pinterest.com/pin/1075093742309995158/,Quick Ricotta Pasta Bake,1,2026-01-19 05:33:16
https://www.pinterest.com/pin/1075093742310463955/,Chocolate Dipped Peanut Butter Pretzels,1,2026-01-19 05:33:17
https://www.pinterest.com/pin/1075093742309987669/,Copycat Cracker Barrel Hash Brown Casserole,1,2026-01-19 05:33:18
https://www.pinterest.com/pin/1075093742310037077/,Cranberry Apple Twice-Baked Sweet Potatoes,1,2026-01-19 05:33:18
https://www.pinterest.com/pin/1075093742309966233/,Croissant Bake,1,2026-01-19 05:33:19
https://www.pinterest.com/pin/1075093742309981491/,Baked Stuffed Shrimp Casserole,1,2026-01-19 05:33:19
https://www.pinterest.com/pin/1075093742309962623/,No-Bake Cranberry Pecan Praline Cookies,1,2026-01-19 05:33:19
https://www.pinterest.com/pin/1075093742309955245/,Slow Cooker Shrimp Boil,1,2026-01-19 05:33:20
https://www.pinterest.com/pin/1075093742309951583/,Air Fryer Sweet Chili Chicken,1,2026-01-19 05:33:20
https://www.pinterest.com/pin/1075093742310461436/,Best Scalloped Sweet Potatoes,1,2026-01-19 05:33:20
https://www.pinterest.com/pin/1075093742309930560/,Million Dollar Spaghetti,1,2026-01-19 05:33:21
https://www.pinterest.com/pin/1075093742310608703/,Sausage &amp; Cream Cheese Biscuit Bites,1,2026-01-19 05:33:21
https://www.pinterest.com/pin/1075093742311170014/,Salted Caramel Butter Bars,1,2026-01-19 05:33:21
https://www.pinterest.com/pin/1075093742309945865/,Turkey stuffing Balls,1,2026-01-19 05:33:21
https://www.pinterest.com/pin/1075093742309919517/,Cranberry Cream Cheese Crescent Bites,1,2026-01-19 05:33:22
https://www.pinterest.com/pin/1075093742310547981/,Slow Cooked Crockpot Cheeseburgers,1,2026-01-19 05:33:22
https://www.pinterest.com/pin/1075093742310539943/,Bang Bang Salmon Recipe,1,2026-01-19 05:33:23
https://www.pinterest.com/pin/1075093742309891206/,French Toast Casserole,1,2026-01-19 05:33:23
https://www.pinterest.com/pin/1075093742309912846/,Beef Stuffed Shells Pasta,1,2026-01-19 05:33:23
https://www.pinterest.com/pin/1075093742309941894/,Pimento Cheese Hash Brown Casserole,1,2026-01-19 05:33:23
https://www.pinterest.com/pin/1075093742309944054/,Berry French Toast Casserole,1,2026-01-19 05:33:23
https://www.pinterest.com/pin/1075093742309882763/,Cranberry Brie Tart with Pancetta &amp; Thyme,1,2026-01-19 05:33:24
https://www.pinterest.com/pin/1075093742309870389/,Christmas Pancakes,1,2026-01-19 05:33:25
https://www.pinterest.com/pin/1075093742309874249/,Eggs Benedict Casserole,1,2026-01-19 05:33:25
https://www.pinterest.com/pin/1075093742309876408/,Stuffed Cornish Game Hens,1,2026-01-19 05:33:25
https://www.pinterest.com/pin/1075093742309872153/,Mini Jalapeño Popper Egg Rolls,1,2026-01-19 05:33:25
https://www.pinterest.com/pin/1075093742309887105/,Easy Crockpot Chicken Rice,1,2026-01-19 05:33:25
https://www.pinterest.com/pin/1075093742309850532/,Crock-Pot French Toast,1,2026-01-19 05:33:26
https://www.pinterest.com/pin/1075093742309879400/,Easy Christmas Fruitcake Cookies Recipe,1,2026-01-19 05:33:26
https://www.pinterest.com/pin/1075093742310400944/,Rosemary Dijon Chicken,1,2026-01-19 05:33:26
https://www.pinterest.com/pin/1075093742309832406/,"Sausage, Rotel &amp; Cream Cheese Crescent Rolls",1,2026-01-19 05:33:26
https://www.pinterest.com/pin/1075093742309821428/,Easy Homemade McGriddle Breakfast Sandwiches,1,2026-01-19 05:33:26
https://www.pinterest.com/pin/1075093742309817152/,Creamy Seafood Stuffed Shells Recipe,1,2026-01-19 05:33:26
https://www.pinterest.com/pin/1075093742309854597/,Easy Baked Pumpkin Donuts,1,2026-01-19 05:33:26
https://www.pinterest.com/pin/1075093742309808980/,Christmas Mistletoe Margarita,1,2026-01-19 05:33:28
https://www.pinterest.com/pin/1075093742310428452/,Slow Cooker Queso Chicken Tacos,1,2026-01-19 05:33:30
https://www.pinterest.com/pin/1075093742309793447/,Creamy Reuben Soup,1,2026-01-19 05:33:30
https://www.pinterest.com/pin/1075093742309773112/,Million Dollar Lasagna,1,2026-01-19 05:33:31
https://www.pinterest.com/pin/1075093742310338541/,Candy Cane Cookies,1,2026-01-19 05:33:32
https://www.pinterest.com/pin/1075093742310164372/,Overnight Blueberry French Toast Casserole,1,2026-01-19 05:33:32
https://www.pinterest.com/pin/1075093742310310260/,Soft Christmas Peppermints,1,2026-01-19 05:33:32
https://www.pinterest.com/pin/1075093742310393860/,Chocolate Croissant Breakfast Bake,1,2026-01-19 05:33:32
https://www.pinterest.com/pin/1075093742309729274/,Italian Meatballs Recipe,1,2026-01-19 05:33:32
https://www.pinterest.com/pin/1075093742310129629/,Gingerbread Rice Krispie Treats,1,2026-01-19 05:33:33
https://www.pinterest.com/pin/1075093742309782291/,Red Velvet Crinkle Cookie,1,2026-01-19 05:33:33
https://www.pinterest.com/pin/1075093742309765675/,Creamy Chicken Cordon Bleu Recipe,1,2026-01-19 05:33:33
https://www.pinterest.com/pin/1075093742309754384/,Easy Grilled Cheese Burrito,1,2026-01-19 05:33:33
https://www.pinterest.com/pin/1075093742309762752/,One Pot Creamy Cajun Meatball Pasta,1,2026-01-19 05:33:33
https://www.pinterest.com/pin/1075093742309725432/,Christmas Morning Punch Recipe,1,2026-01-19 05:33:34
https://www.pinterest.com/pin/1075093742309732754/,Pumpkin Cornbread with Cinnamon Honey Butter,1,2026-01-19 05:33:35
https://www.pinterest.com/pin/1075093742309740364/,Frosted Christmas Brownies,1,2026-01-19 05:33:35
https://www.pinterest.com/pin/1075093742309759215/,Pecan Pie Crescent Rolls,1,2026-01-19 05:33:35
https://www.pinterest.com/pin/1075093742309702377/,Toffee Apple Pie with Vanilla Custard,1,2026-01-19 05:33:35
https://www.pinterest.com/pin/1075093742309695059/,Honey Butter Skillet Corn,1,2026-01-19 05:33:36
https://www.pinterest.com/pin/1075093742309680895/,Italian Chicken Cacciatore Recipe,1,2026-01-19 05:33:36
https://www.pinterest.com/pin/1075093742309698437/,Baked Apple Fritters with Glaze Recipe,1,2026-01-19 05:33:36
https://www.pinterest.com/pin/1075093742309691379/,Starbucks Pumpkin Cream Cheese Muffins Recipe,1,2026-01-19 05:33:36
https://www.pinterest.com/pin/1075093742310169645/,Easy Meatball Pot Roast,1,2026-01-19 05:33:36
https://www.pinterest.com/pin/1075093742309664798/,Sugar Cookie Cheesecake,1,2026-01-19 05:33:37
https://www.pinterest.com/pin/1075093742309683144/,Chicken Spinach Penne,1,2026-01-19 05:33:38
https://www.pinterest.com/pin/1075093742309668399/,Easy Turtle Bars,1,2026-01-19 05:33:38
https://www.pinterest.com/pin/1075093742309685487/,Salted Caramel Apple Pie Cheesecake Recipe,1,2026-01-19 05:33:38
https://www.pinterest.com/pin/1075093742309633492/,Halloween Popcorn Recipe,1,2026-01-19 05:33:38
https://www.pinterest.com/pin/1075093742309634788/,Peppermint Chocolate Chip Cookies,1,2026-01-19 05:33:38
https://www.pinterest.com/pin/1075093742309601625/,Halloween Zombie Swamp Punch,1,2026-01-19 05:33:40
https://www.pinterest.com/pin/1075093742309567067/,Halloween Vampire Coconut Blood Punch,1,2026-01-19 05:33:40
https://www.pinterest.com/pin/1075093742309581161/,Halloween Phantom Vanilla Fudge,1,2026-01-19 05:33:40
https://www.pinterest.com/pin/1075093742309576892/,Halloween Antipasto Eyeballs Appetizer,1,2026-01-19 05:33:41
https://www.pinterest.com/pin/1075093742309563958/,Halloween Blood Moon Fudge,1,2026-01-19 05:33:41
https://www.pinterest.com/pin/1075093742309556375/,Halloween Vampire’s Kiss Strawberry Punch,1,2026-01-19 05:33:41
https://www.pinterest.com/pin/1075093742309549092/,Creepy Cute Mummy Veggie Wraps,1,2026-01-19 05:33:41
https://www.pinterest.com/pin/1075093742309984770/,Creamed Corn Recipe,1,2026-01-19 05:33:42
https://www.pinterest.com/pin/1075093742309545800/,Halloween Eyeball Pasta Salad Recipe,1,2026-01-19 05:33:42
https://www.pinterest.com/pin/1075093742310183758/,The Magic of Soft Christmas Peppermints,1,2026-01-19 05:33:42
https://www.pinterest.com/pin/1075093742310066142/,Country Breakfast Skillet,1,2026-01-19 05:33:42
https://www.pinterest.com/pin/1075093742309552640/,Spooky Halloween Snack Recipe,1,2026-01-19 05:33:42
https://www.pinterest.com/pin/1075093742309529359/,Sliced Baked Potatoes Longhorn,1,2026-01-19 05:33:43
https://www.pinterest.com/pin/1075093742309999134/,Crockpot French Onion Meatballs,1,2026-01-19 05:33:43
https://www.pinterest.com/pin/1075093742309542827/,Cauldron Cookie Cups,1,2026-01-19 05:33:43
https://www.pinterest.com/pin/1075093742309514206/,Healthy Chicken Pomodoro Skillet,1,2026-01-19 05:33:44
https://www.pinterest.com/pin/1075093742309500850/,Garlic Butter Chicken Pasta,1,2026-01-19 05:33:45
https://www.pinterest.com/pin/1075093742309518179/,Sweet Air Fryer Churro Bites Recipe,1,2026-01-19 05:33:45
https://www.pinterest.com/pin/1075093742309490126/,Dragon Chicken Recipe,1,2026-01-19 05:33:45
https://www.pinterest.com/pin/1075093742309482422/,Crispy Dill Pickle Parmesan Chicken,1,2026-01-19 05:33:45
https://www.pinterest.com/pin/1075093742309443041/,Cake Eyeballs,1,2026-01-19 05:33:46
https://www.pinterest.com/pin/1075093742309461685/,Hot Dog Mummies,1,2026-01-19 05:33:46
https://www.pinterest.com/pin/1075093742309452174/,Halloween Cheesecake,1,2026-01-19 05:33:46
https://www.pinterest.com/pin/1075093742309435881/,Halloween Blueberry Mummy Muffins,1,2026-01-19 05:33:46
https://www.pinterest.com/pin/1075093742309429039/,Witch's Potion Punch,1,2026-01-19 05:33:46
https://www.pinterest.com/pin/1075093742309389463/,Halloween Pizza Skulls Recipe,1,2026-01-19 05:33:47
https://www.pinterest.com/pin/1075093742309394487/,Halloween Oreo Dirt Cake Recipe,1,2026-01-19 05:33:47
https://www.pinterest.com/pin/1075093742309439161/,Scary Peanut Butter Spider Cookies,1,2026-01-19 05:33:48
https://www.pinterest.com/pin/1075093742309397755/,Ghostly Halloween Punch,1,2026-01-19 05:33:48
https://www.pinterest.com/pin/1075093742309391701/,Candied Apples for Halloween Recipe,1,2026-01-19 05:33:49
https://www.pinterest.com/pin/1075093742309335523/,Quick Breads,1,2026-01-19 05:33:51
https://www.pinterest.com/pin/1075093742309331949/,Chocolate Hazelnut Twists,1,2026-01-19 05:33:51
https://www.pinterest.com/pin/1075093742309364189/,Sausage and Cabbage Stir Fry,1,2026-01-19 05:33:51
https://www.pinterest.com/pin/1075093742309338787/,Banana Nut Mug Cake,1,2026-01-19 05:33:51
https://www.pinterest.com/pin/1075093742309322620/,Caramel Apple Cheesecake,1,2026-01-19 05:33:51
https://www.pinterest.com/pin/1075093742309290699/,Peanut Butter Marshmallow Cookies,1,2026-01-19 05:33:53
https://www.pinterest.com/pin/1075093742309812762/,Lazy Girl Pecan Pie Bars,1,2026-01-19 05:33:53
https://www.pinterest.com/pin/1075093742309287927/,Birthday Cake Cinnamon Rolls,1,2026-01-19 05:33:54
https://www.pinterest.com/pin/1075093742309977022/,Christmas Sugar Cookies,1,2026-01-19 05:33:54
https://www.pinterest.com/pin/1075093742309298138/,Strawberry Banana Pancakes,1,2026-01-19 05:33:54
https://www.pinterest.com/pin/1075093742309281979/,Delicious Chocolate Puff Pastry,1,2026-01-19 05:33:54
https://www.pinterest.com/pin/1075093742309948068/,Better Than Anything Toffee Recipe,1,2026-01-19 05:33:54
https://www.pinterest.com/pin/1075093742310586700/,Baked Stuffed Salmon With Spinach &amp; Feta,1,2026-01-19 05:33:55
https://www.pinterest.com/pin/1075093742309769087/,Decadent Chocolate Croissant Breakfast Bake,1,2026-01-19 05:33:56
https://www.pinterest.com/pin/1075093742309922973/,Cherry Bourbon Balls,1,2026-01-19 05:33:56
https://www.pinterest.com/pin/1075093742309915756/,Garlic Butter Honey BBQ Chicken Tacos,1,2026-01-19 05:33:57
https://www.pinterest.com/pin/1075093742309191275/,Korean Fried Chicken,1,2026-01-19 05:33:57
https://www.pinterest.com/pin/1075093742309115682/,Lemon Orzo Recipe,1,2026-01-19 05:34:00
https://www.pinterest.com/pin/1075093742309134484/,Crockpot Garlic Butter Chicken Meatballs with Creamy Orzo,1,2026-01-19 05:34:00
https://www.pinterest.com/pin/1075093742309076547/,Lemon Zucchini Bread With Fresh Lemon Glaze,1,2026-01-19 05:34:00
https://www.pinterest.com/pin/1075093742309122864/,Orzo Arugula Salad,1,2026-01-19 05:34:01
https://www.pinterest.com/pin/1075093742309080731/,Roasted Sweet Potato Black Bean Salad,1,2026-01-19 05:34:01
https://www.pinterest.com/pin/1075093742309073139/,One Pan Creamy Meat &amp; Potato Skillet,1,2026-01-19 05:34:02
https://www.pinterest.com/pin/1075093742309063981/,Ground Beef Orzo Recipe,1,2026-01-19 05:34:02
https://www.pinterest.com/pin/1075093742309671687/,Cinnamon Roll Cookies,1,2026-01-19 05:34:02
https://www.pinterest.com/pin/1075093742309066939/,Pumpkin Cinnamon Roll Muffins,1,2026-01-19 05:34:03
https://www.pinterest.com/pin/1075093742309048760/,Creamy Souper Rice,1,2026-01-19 05:34:04
https://www.pinterest.com/pin/1075093742309038875/,Chicken Rice Soup,1,2026-01-19 05:34:05
https://www.pinterest.com/pin/1075093742309026071/,Healthy Chicken Cauliflower Rice,1,2026-01-19 05:34:05
https://www.pinterest.com/pin/1075093742309023378/,Steak and Queso Rice,1,2026-01-19 05:34:05
https://www.pinterest.com/pin/1075093742309029041/,Creamy Angel Chicken,1,2026-01-19 05:34:06
https://www.pinterest.com/pin/1075093742309007765/,Cheesy Taco Rice Recipe,1,2026-01-19 05:34:06
https://www.pinterest.com/pin/1075093742308965643/,Creamy Ricotta Chicken Pasta,1,2026-01-19 05:34:06
https://www.pinterest.com/pin/1075093742308950687/,Smothered Cheesy Sour Cream Chicken,1,2026-01-19 05:34:06
https://www.pinterest.com/pin/1075093742308958222/,Zesty Lemon Chicken Romano Recipe,1,2026-01-19 05:34:06
https://www.pinterest.com/pin/1075093742308945225/,Easy One Pot Cajun Chicken and Rice,1,2026-01-19 05:34:07
https://www.pinterest.com/pin/1075093742308947561/,Chicken Pot Pie Pasta Recipe,1,2026-01-19 05:34:07
https://www.pinterest.com/pin/1075093742309525663/,Fried Pies Recipe,1,2026-01-19 05:34:07
https://www.pinterest.com/pin/1075093742308961481/,Mexican Street Corn Chicken Rice Bowl,1,2026-01-19 05:34:08
https://www.pinterest.com/pin/1075093742309688197/,Grinch Dip Recipe,1,2026-01-19 05:34:10
https://www.pinterest.com/pin/1075093742308880190/,Italian Noodle Casserole,1,2026-01-19 05:34:11
https://www.pinterest.com/pin/1075093742309510495/,Lemon Chicken Romano Recipe,1,2026-01-19 05:34:11
https://www.pinterest.com/pin/1075093742309634800/,M&amp;M’s Marshmallow Dream Bars,1,2026-01-19 05:34:11
https://www.pinterest.com/pin/1075093742308931511/,Creamy Chicken Pot Pie Orzo,1,2026-01-19 05:34:11
https://www.pinterest.com/pin/1075093742308812611/,Spicy Brazilian Coconut Chicken,1,2026-01-19 05:34:12
https://www.pinterest.com/pin/1075093742308793050/,Balsamic Baked Chicken Breast,1,2026-01-19 05:34:14
https://www.pinterest.com/pin/1075093742308775190/,Chicken Tater Tot Casserole,1,2026-01-19 05:34:15
https://www.pinterest.com/pin/1075093742308758844/,Homestyle Chicken and Biscuits,1,2026-01-19 05:34:16
https://www.pinterest.com/pin/1075093742308782357/,Garlic Parmesan Crockpot Chicken and Potatoes,1,2026-01-19 05:34:17
https://www.pinterest.com/pin/1075093742308696170/,Pumpkin Chocolate Chip Muffins,1,2026-01-19 05:34:17
