url,title,saves,upload_date,timestamp
https://www.pinterest.com/pin/1129559150331867089/,Crusty Rolls Made Simple With No Kneading Effort,1,2026-01-16T17:01:35.000Z,2026-01-16 17:57:49
https://www.pinterest.com/pin/1129559150331831477/,Comfort Food Favorite Easy Chicken Pot Pie Recipe,1,2026-01-15T23:36:38.000Z,2026-01-16 17:57:49
https://www.pinterest.com/pin/1129559150331836058/,Delicious Chewy Biscoff Brownies Dessert Recipe,1,2026-01-16T01:50:29.000Z,2026-01-16 17:57:49
https://www.pinterest.com/pin/1129559150331727223/,Simple Chocolate Rice Krispie Treats You Can Make,1,2026-01-13T21:22:39.000Z,2026-01-16 17:57:49
https://www.pinterest.com/pin/1129559150331766710/,Gourmet Croque Madame Sandwich Made With Puff Pastry,1,2026-01-14T17:34:23.000Z,2026-01-16 17:57:49
https://www.pinterest.com/pin/1129559150331717749/,Hearty Beef Ham Potato Soup Comfort Food Recipe,1,2026-01-13T17:40:40.000Z,2026-01-16 17:57:49
https://www.pinterest.com/pin/1129559150331776999/,Creamy Baked Chicken Alfredo You Will Make Again,1,2026-01-14T21:27:40.000Z,2026-01-16 17:57:49
https://www.pinterest.com/pin/1129559150331735890/,Making Soft Fluffy Dinner Rolls Like French Bread,1,2026-01-14T01:49:40.000Z,2026-01-16 17:57:49
https://www.pinterest.com/pin/1129559150331780708/,Decadent Cheesecake French Toast Makes Breakfast Special,1,2026-01-14T23:32:36.000Z,2026-01-16 17:57:49
https://www.pinterest.com/pin/1129559150331784510/,Delicious Homemade Pita Bread Recipe That Actually Puffs,1,2026-01-15T01:46:35.000Z,2026-01-16 17:57:49
https://www.pinterest.com/pin/1129559150331722557/,Spicy Creamy Chicken Recipe You Make So Well,1,2026-01-13T19:14:41.000Z,2026-01-16 17:57:49
https://www.pinterest.com/pin/1129559150331731976/,How To Make Festive Grinch Popcorn Snack Treats,1,2026-01-13T23:33:36.000Z,2026-01-16 17:57:51
https://www.pinterest.com/pin/1129559150331694252/,Making Delicious Non-Alcoholic Baileys Style Coffee At Home,1,2026-01-13T04:34:32.000Z,2026-01-16 17:57:51
https://www.pinterest.com/pin/1129559150331438102/,Comforting Beef Wonton Soup Made Perfectly Simple,1,2026-01-07T17:06:14.000Z,2026-01-16 17:57:52
https://www.pinterest.com/pin/1129559150331414608/,Garlic Cabbage Steaks With Amazing Beef Flavor Recipe,1,2026-01-07T04:23:31.000Z,2026-01-16 17:57:52
https://www.pinterest.com/pin/1129559150331637905/,Flavorful Gin Extract Scallion Chicken Noodle Soup Recipe,1,2026-01-11T21:19:23.000Z,2026-01-16 17:57:52
https://www.pinterest.com/pin/1129559150331409367/,Make Incredible Loaded Beef Reuben Fries Appetizer This Week,1,2026-01-07T01:45:37.000Z,2026-01-16 17:57:52
https://www.pinterest.com/pin/1129559150331673631/,Make This Easy Bluey Cake Recipe Fun For Kids,1,2026-01-12T17:36:02.000Z,2026-01-16 17:57:52
https://www.pinterest.com/pin/1129559150331650161/,Make Spicy Garlic Chicken Broth With Great Flavor,1,2026-01-12T04:21:17.000Z,2026-01-16 17:57:52
https://www.pinterest.com/pin/1129559150331642206/,Delicious Caramel Apple Fudge Dessert Perfection,1,2026-01-11T23:37:36.000Z,2026-01-16 17:57:52
https://www.pinterest.com/pin/1129559150331628241/,Incredibly Moist Carrot Cake Bars You Can Make,1,2026-01-11T17:36:41.000Z,2026-01-16 17:57:52
https://www.pinterest.com/pin/1129559150331645961/,Delicious Simple Butter Pecan Cake Recipe Ideas,1,2026-01-12T01:49:44.000Z,2026-01-16 17:57:52
https://www.pinterest.com/pin/1129559150331632676/,Make This Hearty Irish Beef Cabbage Potato Soup,1,2026-01-11T19:16:41.000Z,2026-01-16 17:57:52
https://www.pinterest.com/pin/1129559150331405509/,Make Comfort Food Morning Pizza With This Recipe,1,2026-01-06T23:32:44.000Z,2026-01-16 17:57:54
https://www.pinterest.com/pin/1129559150331401633/,Making Spicy Hot Honey Pizza Sweet Heat,1,2026-01-06T21:22:38.000Z,2026-01-16 17:57:54
https://www.pinterest.com/pin/1129559150331841285/,Pin on Breakfast Ideas,1,N/A,2026-01-16 17:57:54
https://www.pinterest.com/pin/1129559150331740060/,Delicious Cranberry Beef Sliders For Your Next Party,1,2026-01-14T04:17:12.000Z,2026-01-16 17:57:55
https://www.pinterest.com/pin/1129559150331770937/,Pin on Breakfast Ideas,1,N/A,2026-01-16 17:57:55
https://www.pinterest.com/pin/1129559150331346052/,Make Delicious Peanut Butter Balls With Few Ingredients,1,2026-01-05T17:00:46.000Z,2026-01-16 17:57:55
https://www.pinterest.com/pin/1129559150331322773/,No Bake Cookie Dough Bars Are Such A Delight,1,2026-01-05T03:58:22.000Z,2026-01-16 17:57:55
https://www.pinterest.com/pin/1129559150331318797/,Get Delicious No-Bake Cookie Dough Truffles Right Away,1,2026-01-05T01:51:36.000Z,2026-01-16 17:57:55
https://www.pinterest.com/pin/1129559150331305877/,Creamy Strawberry Shortcake Cheesecake Rolls Recipe,12,2026-01-04T19:16:28.000Z,2026-01-16 17:57:55
https://www.pinterest.com/pin/1129559150331315112/,Comforting Thai Coconut Curry Soup With Savory Beef Dumplings,2,2026-01-04T23:40:31.000Z,2026-01-16 17:57:55
https://www.pinterest.com/pin/1129559150331301531/,Get Sweet Cotton Candy Cookies With This Fun Recipe,9,2026-01-04T17:29:36.000Z,2026-01-16 17:57:55
https://www.pinterest.com/pin/1129559150331254677/,Warming Broth-Based Soup Ideas For Complete Comfort,2,2026-01-03T17:25:14.000Z,2026-01-16 17:57:57
https://www.pinterest.com/pin/1129559150331258847/,Get This Delicious Moist Sweet Potato Cake Recipe,1,2026-01-03T19:12:37.000Z,2026-01-16 17:57:57
https://www.pinterest.com/pin/1129559150331223089/,Make Comforting Homemade Chicken Soup With This Recipe,2,2026-01-02T23:39:26.000Z,2026-01-16 17:57:57
https://www.pinterest.com/pin/1129559150331226906/,The Most Comforting Creamy Tomato Soup Winter Meal,3,2026-01-03T01:45:28.000Z,2026-01-16 17:57:58
https://www.pinterest.com/pin/1129559150331218397/,Delicious Homemade Chicken Pot Pie Soup You Should Make,2,2026-01-02T21:22:26.000Z,2026-01-16 17:57:58
https://www.pinterest.com/pin/1129559150331272951/,Delicious Honey Lemon Pepper Wings Taste Amazing,2,2026-01-04T01:48:33.000Z,2026-01-16 17:57:59
https://www.pinterest.com/pin/1129559150331181099/,Savory Wild Mushroom Soup With Sweet Caramelized Onions,2,2026-01-02T01:48:24.000Z,2026-01-16 17:58:00
https://www.pinterest.com/pin/1129559150331208043/,Deliciously Simple Treat Oreo Fudge Recipe,1,2026-01-02T17:00:53.000Z,2026-01-16 17:58:00
https://www.pinterest.com/pin/1129559150331351845/,Pin on Dessert,1,N/A,2026-01-16 17:58:00
https://www.pinterest.com/pin/1129559150331136166/,Perfect Chewy No-Bake Scotcheroos Dessert Bars Are Ready,5,2026-01-01T01:49:27.000Z,2026-01-16 17:58:00
https://www.pinterest.com/pin/1129559150331310584/,Pin on Dessert,1,N/A,2026-01-16 17:58:00
https://www.pinterest.com/pin/1129559150331362400/,Pin on Dessert,2,N/A,2026-01-16 17:58:01
https://www.pinterest.com/pin/1129559150331357331/,Pin on Dinner Ideas,1,N/A,2026-01-16 17:58:02
https://www.pinterest.com/pin/1129559150331268956/,Delicious Chicken Sliders Recipe That Is So Quick in 2026,1,N/A,2026-01-16 17:58:03
https://www.pinterest.com/pin/1129559150331117167/,Appetizer Bites With Beef Prosciutto And Mozzarella,2,2025-12-31T17:02:05.000Z,2026-01-16 17:58:03
https://www.pinterest.com/pin/1129559150331128379/,Deliciously Fun Trifle Recipe For A Spooky Night,1,2025-12-31T21:29:17.000Z,2026-01-16 17:58:03
https://www.pinterest.com/pin/1129559150331122756/,Cheeseburger Bombs With Garlic Parmesan Flavor,1,2025-12-31T19:17:19.000Z,2026-01-16 17:58:03
https://www.pinterest.com/pin/1129559150331280031/,Pin on Appetizer Ideas,3,N/A,2026-01-16 17:58:03
https://www.pinterest.com/pin/1129559150331093806/,Simple Chicken Slider Casserole Becomes Weeknight Favorite,1,2025-12-31T04:00:27.000Z,2026-01-16 17:58:03
https://www.pinterest.com/pin/1129559150331089874/,Creamy Garlic Parmesan Chicken Pasta You Will Love,1,2025-12-31T01:45:21.000Z,2026-01-16 17:58:04
https://www.pinterest.com/pin/1129559150331264253/,Making The Richest Creamy Mushroom Soup At Home in 2026,26,N/A,2026-01-16 17:58:04
https://www.pinterest.com/pin/1129559150331231611/,Moist Carrot Cake Bars Taste So Delicious in 2026,1,N/A,2026-01-16 17:58:04
https://www.pinterest.com/pin/1129559150331212813/,Mouthwatering Creamy Garlic Chicken Makes Dinner Great in 2026,10,N/A,2026-01-16 17:58:04
https://www.pinterest.com/pin/1129559150331086466/,6 Easy Baked Chicken Leg Recipes To Try,3,2025-12-30T23:37:27.000Z,2026-01-16 17:58:05
https://www.pinterest.com/pin/1129559150331081362/,Delicious Lemon Meltaway Cookies That Crumble Perfectly,1,2025-12-30T21:20:19.000Z,2026-01-16 17:58:05
https://www.pinterest.com/pin/1129559150330910310/,Sweet Homemade Strawberry Cinnamon Rolls For Breakfast,2,2025-12-27T04:17:23.000Z,2026-01-16 17:58:06
https://www.pinterest.com/pin/1129559150331026187/,Sweet Dessert Making With This Simple Peach Cobbler,8,2025-12-29T17:25:38.000Z,2026-01-16 17:58:06
https://www.pinterest.com/pin/1129559150331031170/,Get Delightful Mini Cheesecake Cups Using Simple Steps,1,2025-12-29T19:09:19.000Z,2026-01-16 17:58:06
https://www.pinterest.com/pin/1129559150330904416/,Appetizers You Can Prepare Before Your Holiday Party,1,2025-12-27T01:48:26.000Z,2026-01-16 17:58:06
https://www.pinterest.com/pin/1129559150330900680/,Delicious Stuffed Potato Cakes You Can Make Fast,4,2025-12-26T23:31:15.000Z,2026-01-16 17:58:06
https://www.pinterest.com/pin/1129559150330895199/,Sweet Strawberry Cookies Dipped In Rich Chocolate Frosting,2,2025-12-26T21:26:19.000Z,2026-01-16 17:58:06
https://www.pinterest.com/pin/1129559150330890433/,Delicious Peanut Butter Sandwich Cookies That Melt,1,2025-12-26T19:12:27.000Z,2026-01-16 17:58:07
https://www.pinterest.com/pin/1129559150331192180/,Make Delicious Candy Grapes With This Easy Recipe in 2026,4,N/A,2026-01-16 17:58:07
https://www.pinterest.com/pin/1129559150330884793/,Juicy Air Fryer Beef Chop Bites Make Dinner Better,2,2025-12-26T17:02:00.000Z,2026-01-16 17:58:07
https://www.pinterest.com/pin/1129559150331076117/,Make Perfect Bang Bang Chicken Sliders For Parties,1,2025-12-30T19:09:22.000Z,2026-01-16 17:58:07
https://www.pinterest.com/pin/1129559150330864474/,Delicious No-Bake Oreo Balls That Taste Amazing,1,2025-12-26T04:19:33.000Z,2026-01-16 17:58:08
https://www.pinterest.com/pin/1129559150330860861/,Get Truly Fudgy Chewy Brookies For Your Dessert,1,2025-12-26T01:49:23.000Z,2026-01-16 17:58:08
https://www.pinterest.com/pin/1129559150331139695/,"Sweet Salty Delight Peanut Butter Bars Are Very Simple in 2026 | Sweet and salty, Peanut butter bars, Decadent chocolate desserts",2,N/A,2026-01-16 17:58:08
https://www.pinterest.com/pin/1129559150331071159/,Creamy Beef Flavor Outback Potato Soup Recipe Here,1,2025-12-30T17:05:08.000Z,2026-01-16 17:58:08
https://www.pinterest.com/pin/1129559150330819050/,Make Beautiful Chocolate Dipped Brownie Hearts For Sharing,3,2025-12-24T23:36:23.000Z,2026-01-16 17:58:08
https://www.pinterest.com/pin/1129559150330853825/,Amazing Non Alcoholic Valentine Sugar Cookies Sweet Treat,1,2025-12-25T21:24:24.000Z,2026-01-16 17:58:09
https://www.pinterest.com/pin/1129559150330815006/,Homemade Air Fryer Donuts Become A Quick Reality,2,2025-12-24T21:20:18.000Z,2026-01-16 17:58:09
https://www.pinterest.com/pin/1129559150330807055/,Delicious Winter Wonderland Cookies Using Chocolate Chips,1,2025-12-24T17:24:33.000Z,2026-01-16 17:58:09
https://www.pinterest.com/pin/1129559150331132248/,Quick Salted Caramel Bars You Can Make,1,2025-12-31T23:35:40.000Z,2026-01-16 17:58:09
https://www.pinterest.com/pin/1129559150330810985/,Making Cbeef and Champagne Beef with Grapes Delightful,1,2025-12-24T19:09:25.000Z,2026-01-16 17:58:09
https://www.pinterest.com/pin/1129559150330783776/,Creative Pavlova Wreath Makes Beautiful Centerpiece Dessert,1,2025-12-24T04:23:11.000Z,2026-01-16 17:58:09
https://www.pinterest.com/pin/1129559150330777114/,Homemade Strawberry Donuts Taste Better Than Bakery Ones,1,2025-12-23T23:34:24.000Z,2026-01-16 17:58:10
https://www.pinterest.com/pin/1129559150330857494/,Delicious Mini Oreo Cheesecakes Make Sweet Delight,2,2025-12-25T23:35:25.000Z,2026-01-16 17:58:10
https://www.pinterest.com/pin/1129559150330772917/,Amazing Non-Alcoholic Valentine Oreo M&M Cookie Recipe,1,2025-12-23T21:19:13.000Z,2026-01-16 17:58:10
https://www.pinterest.com/pin/1129559150330767459/,Adorable Christmas Tree Cupcakes For Your Holiday Table,1,2025-12-23T19:09:18.000Z,2026-01-16 17:58:10
https://www.pinterest.com/pin/1129559150330735246/,Quick Strawberry Cake Mix Cookies You Will Love,13,2025-12-23T01:47:25.000Z,2026-01-16 17:58:11
https://www.pinterest.com/pin/1129559150330738853/,Quick Ground Turkey Pasta For Busy Weeknights,1,2025-12-23T04:05:28.000Z,2026-01-16 17:58:11
https://www.pinterest.com/pin/1129559150330763509/,Make Creamy Cajun Beef Pasta In Only 30 Minutes,1,2025-12-23T17:34:32.000Z,2026-01-16 17:58:11
https://www.pinterest.com/pin/1129559150330728085/,Decadent Christmas Black Forest Trifle For Sharing,2,2025-12-22T21:26:26.000Z,2026-01-16 17:58:11
https://www.pinterest.com/pin/1129559150330732158/,Fudgy Strawberry Brownies That Are So Delicious,1,2025-12-22T23:36:19.000Z,2026-01-16 17:58:11
https://www.pinterest.com/pin/1129559150330718177/,Delicious No-Bake Peanut Butter Cookies You Can Make,1,2025-12-22T17:02:20.000Z,2026-01-16 17:58:12
https://www.pinterest.com/pin/1129559150330722604/,Quick 1 Pan Chicken Noodles For Dinner,1,2025-12-22T19:07:17.000Z,2026-01-16 17:58:12
https://www.pinterest.com/pin/1129559150330546566/,Cozy Beef Gravy Puff Pie For Ultimate Comfort,1,2025-12-18T21:25:27.000Z,2026-01-16 17:58:12
https://www.pinterest.com/pin/1129559150330541350/,Get Perfectly Crispy Fried Homemade Mac and Cheese Bites,1,2025-12-18T19:08:23.000Z,2026-01-16 17:58:12
https://www.pinterest.com/pin/1129559150330537016/,Sweet Christmas Tree Cake Truffles You Should Make,2,2025-12-18T17:03:55.000Z,2026-01-16 17:58:13
https://www.pinterest.com/pin/1129559150330554224/,Delicious Pumpkin Ravioli Needs Sage Butter Sauce,11,2025-12-19T01:49:18.000Z,2026-01-16 17:58:13
https://www.pinterest.com/pin/1129559150330464205/,Make This Decadent Chocolate Chip Cookie Cheesecake,159,2025-12-17T01:51:22.000Z,2026-01-16 17:58:13
https://www.pinterest.com/pin/1129559150330468631/,Get Those Perfect Strawberry Swirl Cheesecake Cookie Cups,1,2025-12-17T04:18:37.000Z,2026-01-16 17:58:14
https://www.pinterest.com/pin/1129559150330444806/,Delicious Roast Beef Sliders Make Any Party Special,1,2025-12-16T17:05:41.000Z,2026-01-16 17:58:14
https://www.pinterest.com/pin/1129559150330425161/,Make Cheesy Beef Sausage Hashbrown Casserole Ahead,103,2025-12-16T03:56:38.000Z,2026-01-16 17:58:15
https://www.pinterest.com/pin/1129559150330421305/,Savory Beef Sausage Hashbrown Casserole You Should Try,1,2025-12-16T01:44:28.000Z,2026-01-16 17:58:15
https://www.pinterest.com/pin/1129559150330512825/,Make Refreshing Orange Crush Sherbet Without Any Fuss,1,2025-12-18T03:56:13.000Z,2026-01-16 17:58:15
https://www.pinterest.com/pin/1129559150330413914/,Make Delicious Butterfinger Balls Without Baking,23,2025-12-15T21:25:31.000Z,2026-01-16 17:58:15
https://www.pinterest.com/pin/1129559150330417620/,Best Beef Comfort Food Casserole You Will Make,2,2025-12-15T23:36:23.000Z,2026-01-16 17:58:15
https://www.pinterest.com/pin/1129559150330408867/,Delicious Copycat Filet-O-Fish Sliders You Can Make,1,2025-12-15T19:16:26.000Z,2026-01-16 17:58:16
https://www.pinterest.com/pin/1129559150330404554/,Bites Featuring Beef Prosciutto Mozzarella Appetizer,1,2025-12-15T17:21:38.000Z,2026-01-16 17:58:16
https://www.pinterest.com/pin/1129559150330780181/,Nutella Puff Pastry Star Wreath Recipe-Easy Holiday Treat | Opskrift,1,N/A,2026-01-16 17:58:16
https://www.pinterest.com/pin/1129559150330366508/,Bright Lemon Thyme Flavor For Grilled Halloumi Skewers,2,2025-12-14T19:10:16.000Z,2026-01-16 17:58:17
https://www.pinterest.com/pin/1129559150330559281/,"Cherry Pie Cookies – Easy Homemade Treat | Recipe | Cherry pie cookies, Homemade cherry pies, Dessert recipes easy",2,N/A,2026-01-16 17:58:17
https://www.pinterest.com/pin/1129559150330361693/,Delicious Mini Lemon Cheesecakes You Will Want To Make,2,2025-12-14T17:05:58.000Z,2026-01-16 17:58:17
https://www.pinterest.com/pin/1129559150330337455/,Set Up Your Festive Drink Station For Less Money,1,2025-12-14T03:58:42.000Z,2026-01-16 17:58:17
https://www.pinterest.com/pin/1129559150330333404/,Make Delicious Mini Beef Quiches For Any Gathering,3,2025-12-14T01:43:15.000Z,2026-01-16 17:58:18
https://www.pinterest.com/pin/1129559150330328782/,Creative Healthy Halloween Treats That Kids Actually Eat,1,2025-12-13T23:34:13.000Z,2026-01-16 17:58:18
https://www.pinterest.com/pin/1129559150330551111/,Easy Slice-and-Bake Non-Alcohol Valentine’s Cookies | Opskrift,1,N/A,2026-01-16 17:58:18
https://www.pinterest.com/pin/1129559150330324829/,Make Irresistible Cheesy Potato Balls For Parties,5,2025-12-13T21:23:16.000Z,2026-01-16 17:58:18
https://www.pinterest.com/pin/1129559150330319954/,Simple Grinch Party Ideas For Festive Fun,1,2025-12-13T19:14:17.000Z,2026-01-16 17:58:19
https://www.pinterest.com/pin/1129559150330291399/,Hot Honey Ricotta Dip That Makes Appetizers Better,1,2025-12-13T04:00:28.000Z,2026-01-16 17:58:19
https://www.pinterest.com/pin/1129559150330314617/,Bold Cajun Steak Alfredo Brings Intense Flavor To Pasta,1,2025-12-13T17:05:54.000Z,2026-01-16 17:58:19
https://www.pinterest.com/pin/1129559150330455795/,Easy Punch Bowl Cake Recipe – Party Favorite | Opskrift,1,N/A,2026-01-16 17:58:20
https://www.pinterest.com/pin/1129559150330460003/,"Cheesy Beef Taco Pasta Recipe – Quick & Easy Dinner | Recipe | Healthy food dishes, Pasta dishes, Mediteranian diet recipes",16,N/A,2026-01-16 17:58:20
https://www.pinterest.com/pin/1129559150330284248/,Great Chicken Noodles Made in 1 Pan,4,2025-12-12T23:32:21.000Z,2026-01-16 17:58:20
https://www.pinterest.com/pin/1129559150330279665/,Sweet Non-Alcoholic Valentine Pretzel Treats You Can Make,1,2025-12-12T21:19:14.000Z,2026-01-16 17:58:20
https://www.pinterest.com/pin/1129559150330509954/,Easy Whoopie Pies-Soft Creamy Dessert Recipe | Opskrift,3,N/A,2026-01-16 17:58:20
https://www.pinterest.com/pin/1129559150330184278/,Hearty Beef Sausage Casserole With Green Beans,2,2025-12-10T17:03:28.000Z,2026-01-16 17:58:21
https://www.pinterest.com/pin/1129559150330189344/,Get Irresistible Chewy Coconut Cookies Texture And Flavor,3,2025-12-10T19:10:15.000Z,2026-01-16 17:58:21
https://www.pinterest.com/pin/1129559150330450402/,Easy One Pot Chicken Parmesan Pasta Recipe | Opskrift,1,N/A,2026-01-16 17:58:21
https://www.pinterest.com/pin/1129559150330161450/,Delicious White Chocolate Raspberry Cake Recipe Without Alcohol,3,2025-12-10T03:58:02.000Z,2026-01-16 17:58:21
https://www.pinterest.com/pin/1129559150330194228/,Delicious White Chocolate Orange Truffles Recipe Inside,1,2025-12-10T21:28:21.000Z,2026-01-16 17:58:21
https://www.pinterest.com/pin/1129559150330198595/,Try This Decadent and Delicious Oreo Cake Balls Recipe,3,2025-12-10T23:40:16.000Z,2026-01-16 17:58:21
https://www.pinterest.com/pin/1129559150330154287/,Irresistible No-Bake Sugar Cookie Truffles You Must Try,4,2025-12-09T23:40:18.000Z,2026-01-16 17:58:22
https://www.pinterest.com/pin/1129559150330150214/,Sweet No Bake Cookie Dough Dip You Will Love,4,2025-12-09T21:26:18.000Z,2026-01-16 17:58:22
https://www.pinterest.com/pin/1129559150330118095/,Perfect Little Beef Bacon Ranch Cheese Balls To Make,1,2025-12-09T01:45:17.000Z,2026-01-16 17:58:23
https://www.pinterest.com/pin/1129559150330114472/,Delicious Creamy Caprese Pasta Salad For Summer,1,2025-12-08T23:31:13.000Z,2026-01-16 17:58:23
https://www.pinterest.com/pin/1129559150330121746/,Decadent Apple Crumble Cheesecake You Must Try Making,2,2025-12-09T03:56:29.000Z,2026-01-16 17:58:23
https://www.pinterest.com/pin/1129559150330140799/,Flavorful Bites With Fresh Caprese Salad Skewers,3,2025-12-09T17:04:24.000Z,2026-01-16 17:58:23
https://www.pinterest.com/pin/1129559150330100581/,Delicious Pesto Chicken Garlic Bread You Can Make,1,2025-12-08T17:23:53.000Z,2026-01-16 17:58:23
https://www.pinterest.com/pin/1129559150330069464/,Delicious Strawberry French Toast Muffins For Brunch,10,2025-12-07T23:35:15.000Z,2026-01-16 17:58:23
https://www.pinterest.com/pin/1129559150330072779/,Creamy Spinach Artichoke Wonton Cups Appetizer Recipe,1,2025-12-08T01:46:23.000Z,2026-01-16 17:58:23
https://www.pinterest.com/pin/1129559150330075954/,Delicious Beef Taco Stuffed Shells Made Simple,5,2025-12-08T03:58:28.000Z,2026-01-16 17:58:23
https://www.pinterest.com/pin/1129559150330104876/,Make Delicious Cheesy Potato Burritos For Dinner,22,2025-12-08T19:10:15.000Z,2026-01-16 17:58:23
https://www.pinterest.com/pin/1129559150330110297/,Impress Guests With These Simple Beef Skewer Appetizers,1,2025-12-08T21:21:17.000Z,2026-01-16 17:58:24
https://www.pinterest.com/pin/1129559150330065798/,Ultimate Comfort Food: Spaghetti Stuffed Garlic Bread You Make,1,2025-12-07T21:22:23.000Z,2026-01-16 17:58:25
https://www.pinterest.com/pin/1129559150330061124/,Get This Easy Chicken Pot Pie Pasta Bake Comfort Food,1,2025-12-07T19:10:23.000Z,2026-01-16 17:58:25
https://www.pinterest.com/pin/1129559150330055974/,Make Ahead Blueberry French Toast Casserole This Week,1,2025-12-07T17:03:27.000Z,2026-01-16 17:58:25
https://www.pinterest.com/pin/1129559150329988204/,Creative Party Recipes For Stunning Holiday Appetizers,1,2025-12-06T03:56:51.000Z,2026-01-16 17:58:25
https://www.pinterest.com/pin/1129559150330032781/,Assemble Creative Christmas Tree Sandwiches For Your Party,1,2025-12-07T03:58:51.000Z,2026-01-16 17:58:25
https://www.pinterest.com/pin/1129559150329984968/,Perfect Beef Bacon Potato Frittata Just Like Ina Garten,1,2025-12-06T01:44:18.000Z,2026-01-16 17:58:26
https://www.pinterest.com/pin/1129559150329981981/,Make Amazing Spicy Hot Honey Wings With Sweet Heat,28,2025-12-05T23:40:18.000Z,2026-01-16 17:58:26
https://www.pinterest.com/pin/1129559150329967371/,Get The Easiest Crockpot Jalapeno Corn Dip Recipe,11,2025-12-05T17:05:23.000Z,2026-01-16 17:58:26
https://www.pinterest.com/pin/1129559150329977246/,Make Flavorful General Tso's Chicken Stir Fry Tonight,23,2025-12-05T21:19:10.000Z,2026-01-16 17:58:26
https://www.pinterest.com/pin/1129559150329943554/,Quick Beef Breakfast Casserole Making Weekends Better,1,2025-12-05T03:55:44.000Z,2026-01-16 17:58:26
https://www.pinterest.com/pin/1129559150330287678/,Festive Frosted Christmas Brownies-Easy Recipe | Opskrift,2,N/A,2026-01-16 17:58:26
https://www.pinterest.com/pin/1129559150329937365/,Making That Famous Cookie Monster Ice Cream Treat,1,2025-12-04T23:40:13.000Z,2026-01-16 17:58:27
https://www.pinterest.com/pin/1129559150329940418/,Make Sweet Starbucks Cake Pops Without The Coffee Shop,1,2025-12-05T01:46:20.000Z,2026-01-16 17:58:27
https://www.pinterest.com/pin/1129559150330159626/,"Lemon Coconut Protein Balls-Easy Healthy Snack | Recipe | Lemon coconut, Coconut energy balls, Snacks",7,N/A,2026-01-16 17:58:28
https://www.pinterest.com/pin/1129559150329972168/,Make Appetizing Spicy Beef Taco Pinwheels For Guests,2,2025-12-05T19:09:19.000Z,2026-01-16 17:58:28
https://www.pinterest.com/pin/1129559150329925019/,Make Tender Honey BBQ Baked Chicken In Minutes,9,2025-12-04T17:05:10.000Z,2026-01-16 17:58:28
https://www.pinterest.com/pin/1129559150329933584/,Perfect Loaded Beef Bacon Cheddar Potatoes Recipe,1,2025-12-04T21:20:17.000Z,2026-01-16 17:58:28
https://www.pinterest.com/pin/1129559150329883126/,Perfect Mini Caprese Skewers For Your Next Gathering,1,2025-12-03T17:01:32.000Z,2026-01-16 17:58:29
https://www.pinterest.com/pin/1129559150329888559/,Making Sweet and Savory Delight Crispy Honey Chicken,1,2025-12-03T19:13:22.000Z,2026-01-16 17:58:29
https://www.pinterest.com/pin/1129559150329856959/,Get Truly Irresistible Chewy M-M Chocolate Chip Cookies,4,2025-12-03T01:49:19.000Z,2026-01-16 17:58:29
https://www.pinterest.com/pin/1129559150329861665/,Make Perfect Rice Krispie Balls With This Simple Method,3,2025-12-03T04:18:13.000Z,2026-01-16 17:58:29
https://www.pinterest.com/pin/1129559150329853673/,Simple Beef Sausage Roll-Ups For A Great Morning,2,2025-12-02T23:38:21.000Z,2026-01-16 17:58:29
https://www.pinterest.com/pin/1129559150330145105/,"Easy Crockpot Beef Smokies Recipe-Flavorful Appetizer | Recipe | Party food appetizers, Appetizer recipes, Appetizers for party",1,N/A,2026-01-16 17:58:29
https://www.pinterest.com/pin/1129559150329850029/,Cozy Chai Pumpkin Latte Cupcakes For Perfect Autumn Baking,1,2025-12-02T21:21:22.000Z,2026-01-16 17:58:29
https://www.pinterest.com/pin/1129559150329841419/,Decadent Pink Snickers Cheesecake Dessert You Will Make,1,2025-12-02T17:01:52.000Z,2026-01-16 17:58:30
https://www.pinterest.com/pin/1129559150329813787/,Appetizer Delight Using Spinach Artichoke Wonton Cups,1,2025-12-01T23:33:16.000Z,2026-01-16 17:58:31
https://www.pinterest.com/pin/1129559150329820642/,Sweet Smoky Appetizer Made With Easy Mississippi Beef Smokies,4,2025-12-02T03:59:42.000Z,2026-01-16 17:58:31
https://www.pinterest.com/pin/1129559150329817419/,Moist Carrot Cake Bars Taste So Delicious Indeed,27,2025-12-02T01:52:21.000Z,2026-01-16 17:58:31
https://www.pinterest.com/pin/1129559150330029516/,"Easy Frozen Chocolate Yogurt Clusters Recipe | Recipe | Decadent chocolate desserts, Chocolate yogurt, Frozen chocolate",2,N/A,2026-01-16 17:58:31
https://www.pinterest.com/pin/1129559150329810648/,Delicious Spinach Artichoke Wonton Cups You Will Love,2,2025-12-01T21:25:20.000Z,2026-01-16 17:58:31
https://www.pinterest.com/pin/1129559150329738392/,Get Soft Pumpkin Whoopie Pies For A Great Fall Treat,2,2025-11-30T04:00:56.000Z,2026-01-16 17:58:31
https://www.pinterest.com/pin/1129559150329773560/,Creamy Spinach Artichoke Wonton Cups For Parties,21,2025-11-30T23:33:15.000Z,2026-01-16 17:58:32
https://www.pinterest.com/pin/1129559150329733629/,Flavorful Garlic Parmesan Chicken Skewers You Will Love,15,2025-11-30T01:48:15.000Z,2026-01-16 17:58:32
