url,title,saves,timestamp
https://www.pinterest.com/pin/1075093742311575448/,Winter Wonderland Chocolate Chip Cookies,4,2026-01-19 05:32:04
https://www.pinterest.com/pin/1075093742311518964/,Cheesy Sausage Muffins Recipe,4,2026-01-19 05:32:05
https://www.pinterest.com/pin/1075093742311446696/,Warm Cinnamon Crescent Twists,4,2026-01-19 05:32:07
https://www.pinterest.com/pin/1075093742311271928/,Cranberry Turkey Grilled Cheese,4,2026-01-19 05:32:16
https://www.pinterest.com/pin/1075093742311238032/,Chicken and Dressing Casserole Recipe,4,2026-01-19 05:32:18
https://www.pinterest.com/pin/1075093742311053717/,"Sausage, Gravy, and Biscuit Pie",4,2026-01-19 05:32:25
https://www.pinterest.com/pin/1075093742310999982/,One Pan Chicken with Buttered Noodles,4,2026-01-19 05:32:29
https://www.pinterest.com/pin/1075093742310857095/,Gumbo Recipe,4,2026-01-19 05:32:36
https://www.pinterest.com/pin/1075093742310884233/,Roasted Garlic Mashed Potatoes Recipe,4,2026-01-19 05:32:36
https://www.pinterest.com/pin/1075093742311100173/,Cheesy Chicken Enchiladas with Creamy Sauce,4,2026-01-19 05:32:58
https://www.pinterest.com/pin/1075093742310920113/,Barefoot Contessa Chicken Piccata,4,2026-01-19 05:32:58
https://www.pinterest.com/pin/1075093742310281578/,Turkey Cranberry Crescent Ring Recipe,4,2026-01-19 05:33:04
https://www.pinterest.com/pin/1075093742310299119/,Brown Sugar Pop Tart Cookies,4,2026-01-19 05:33:32
https://www.pinterest.com/pin/1075093742309426591/,Halloween Punch Recipe,4,2026-01-19 05:33:48
https://www.pinterest.com/pin/1075093742309309449/,Chocolate Hazelnut Thumbprint Cookies,4,2026-01-19 05:33:52
https://www.pinterest.com/pin/1075093742309061468/,Creamy French Chicken Casserole,4,2026-01-19 05:34:03
https://www.pinterest.com/pin/1075093742308830881/,Balsamic Baked Chicken Breast,4,2026-01-19 05:34:12
https://www.pinterest.com/pin/1075093742308613532/,Forgotten Chicken Casserole,4,2026-01-19 05:34:22
https://www.pinterest.com/pin/1075093742308434672/,Cream of Spring Vegetable Soup,4,2026-01-19 05:34:33
https://www.pinterest.com/pin/1075093742308904775/,Halloween Meatballs Recipe,4,2026-01-19 05:34:36
https://www.pinterest.com/pin/1075093742307976744/,Easy Ground Chicken Fried Rice,4,2026-01-19 05:34:50
https://www.pinterest.com/pin/1075093742309374605/,Crispy Baked Parmesan Zucchini Recipe,4,2026-01-19 05:34:54
https://www.pinterest.com/pin/1075093742307520324/,Emergency Chicken Rice Casserole,4,2026-01-19 05:35:14
https://www.pinterest.com/pin/1075093742307360242/,Lazy Day Creamy Chicken &amp; Rice Casserole,4,2026-01-19 05:35:22
https://www.pinterest.com/pin/1075093742307268850/,Creamy Layered Pumpkin,4,2026-01-19 05:35:26
https://www.pinterest.com/pin/1075093742307008740/,Easy Banana Cake,4,2026-01-19 05:35:37
https://www.pinterest.com/pin/panna-cotta-with-berry-sauce-cooking-circuit--1075093742306640563/,Panna Cotta with Berry Sauce,4,2026-01-19 05:35:54
https://www.pinterest.com/pin/butterfinger-cookies-cooking-circuit--1075093742306552774/,Butterfinger Cookies,4,2026-01-19 05:35:59
https://www.pinterest.com/pin/cilantro-lime-shrimp-tacos-with-creamy-slaw-cooking-circuit--1075093742306476397/,Cilantro Lime Shrimp Tacos with Creamy Slaw,4,2026-01-19 05:36:02
https://www.pinterest.com/pin/chicken-baked-with-asparagus-cooking-circuit--1075093742306434562/,Chicken Baked with Asparagus,4,2026-01-19 05:36:04
https://www.pinterest.com/pin/1075093742306456964/,Quick &amp; Easy Creamy Spinach Orzo,4,2026-01-19 05:36:05
https://www.pinterest.com/pin/air-fryer-honey-garlic-salmon-cooking-circuit--1075093742306399519/,Air Fryer Honey Garlic Salmon,4,2026-01-19 05:36:07
https://www.pinterest.com/pin/taco-lunch-bowls-cooking-circuit--1075093742306328125/,Taco Lunch Bowls,4,2026-01-19 05:36:10
https://www.pinterest.com/pin/easy-banana-protein-muffins-recipe-cooking-circuit--1075093742306269568/,Easy Banana Protein Muffins Recipe,4,2026-01-19 05:36:15
https://www.pinterest.com/pin/creamy-skillet-tortellini-with-sweet-potato-and-spinach-cooking-circuit--1075093742306206947/,Creamy Skillet Tortellini with Sweet Potato and Spinach,4,2026-01-19 05:36:16
https://www.pinterest.com/pin/healthy-chicken-and-broccoli-stir-fry-cooking-circuit--1075093742306080275/,Healthy Chicken and Broccoli Stir Fry,4,2026-01-19 05:36:24
https://www.pinterest.com/pin/chicken-in-basil-cream-sauce-cooking-circuit--1075093742306000042/,Chicken in Basil Cream Sauce,4,2026-01-19 05:36:26
https://www.pinterest.com/pin/1075093742305951184/,La Scala Chopped Salad Recipe,4,2026-01-19 05:36:29
https://www.pinterest.com/pin/1075093742305893326/,French Onion Pot Roast,4,2026-01-19 05:36:34
https://www.pinterest.com/pin/1075093742305798922/,Air Fryer French Toast Sticks,4,2026-01-19 05:36:37
https://www.pinterest.com/pin/1075093742305713252/,Zucchini Cheddar Cheese Herb Beer Bread,4,2026-01-19 05:36:39
https://www.pinterest.com/pin/lemon-chicken-artichoke-pasta-salad-cooking-circuit--1075093742305642242/,Lemon Chicken Artichoke Pasta Salad,4,2026-01-19 05:36:45
https://www.pinterest.com/pin/strawberry-cheesecake-cinnabon-rolls-cooking-circuit--1075093742306292332/,Strawberry Cheesecake Cinnabon Rolls,4,2026-01-19 05:36:47
https://www.pinterest.com/pin/1075093742306054018/,Creamy Chicken Stuffed Peppers,4,2026-01-19 05:36:57
https://www.pinterest.com/pin/1075093742305332026/,Ground Kung Pao Chicken,4,2026-01-19 05:37:00
https://www.pinterest.com/pin/1075093742305259544/,Quick Rainbow Orzo Salad,4,2026-01-19 05:37:03
https://www.pinterest.com/pin/1075093742305226033/,HEALTHY Chicken and Broccoli Pasta Bake,4,2026-01-19 05:37:04
https://www.pinterest.com/pin/1075093742305197550/,One Pot Broccoli Cheese Orzo,4,2026-01-19 05:37:06
https://www.pinterest.com/pin/dinner-recipes--1075093742306424315/,Spinach Stuffed Chicken Breasts,4,2026-01-19 05:37:06
https://www.pinterest.com/pin/1075093742305161692/,Healthy Mexican Street Corn Chicken Salad,4,2026-01-19 05:37:08
https://www.pinterest.com/pin/1075093742305132568/,One Pan Cilantro Lime Chicken and Rice,4,2026-01-19 05:37:09
https://www.pinterest.com/pin/1075093742305702828/,Western Omelet Quiche,4,2026-01-19 05:37:13
https://www.pinterest.com/pin/creamy-tortellini-soup-cooking-circuit--1075093742306176929/,Creamy Tortellini Soup,4,2026-01-19 05:37:18
https://www.pinterest.com/pin/creamy-dijon-chicken-in-garlic-sauce-cooking-circuit--1075093742304246322/,Creamy Dijon Chicken in Garlic Sauce,4,2026-01-19 05:37:23
https://www.pinterest.com/pin/1075093742304122105/,Healthy Sweet and Sour Chicken,4,2026-01-19 05:37:31
https://www.pinterest.com/pin/1075093742304062829/,Honey Orange Shrimp,4,2026-01-19 05:37:35
https://www.pinterest.com/pin/1075093742303858870/,Hot Honey Feta Chicken,4,2026-01-19 05:37:47
https://www.pinterest.com/pin/1075093742303686917/,Summer Peach and Blueberry Kale Salad,4,2026-01-19 05:37:54
https://www.pinterest.com/pin/1075093742303605912/,Lemon Pepper Chicken Thighs,4,2026-01-19 05:37:58
https://www.pinterest.com/pin/1075093742303550699/,Ooey Gooey Banana Bars,4,2026-01-19 05:38:02
https://www.pinterest.com/pin/1075093742303501585/,Healthy Teriyaki Ground Turkey Bowl,4,2026-01-19 05:38:05
https://www.pinterest.com/pin/1075093742303816961/,Street Corn Chicken Rice Bowl,4,2026-01-19 05:38:15
https://www.pinterest.com/pin/mexican-chicken-with-cheese-sauce-cooking-circuit--1075093742303322970/,Mexican Chicken with Cheese Sauce,4,2026-01-19 05:38:16
https://www.pinterest.com/pin/baked-tuscan-chicken-casserole-cooking-circuit--1075093742302760490/,Baked Tuscan Chicken Casserole,4,2026-01-19 05:38:39
https://www.pinterest.com/pin/1075093742302511763/,One Pot Garlic Butter Chicken Orzo,4,2026-01-19 05:38:55
https://www.pinterest.com/pin/creamy-broccoli-cheddar-orzo-cooking-circuit--1075093742302490379/,Creamy Broccoli Cheddar Orzo,4,2026-01-19 05:38:58
https://www.pinterest.com/pin/chicken-marsala-pasta-cooking-circuit--1075093742302428524/,Chicken Marsala Pasta,4,2026-01-19 05:39:01
https://www.pinterest.com/pin/feta-baked-chicken-with-sundried-tomatoes-cooking-circuit--1075093742302391749/,Feta Baked Chicken with Sun-Dried Tomatoes,4,2026-01-19 05:39:04
https://www.pinterest.com/pin/1075093742302834970/,Chicken Teriyaki Fried Rice,4,2026-01-19 05:39:04
https://www.pinterest.com/pin/1075093742302169835/,High Protein Chicken Orzo,4,2026-01-19 05:39:13
https://www.pinterest.com/pin/mediterranean-chicken-gyro-bowls-cooking-circuit--1075093742302106823/,Mediterranean Chicken Gyro Bowls,4,2026-01-19 05:39:19
https://www.pinterest.com/pin/ham-egg-cheese-breakfast-sandwich-recipe-cooking-circuit--1075093742302048870/,Ham Egg &amp; Cheese Breakfast Sandwich Recipe,4,2026-01-19 05:39:25
https://www.pinterest.com/pin/1075093742301950760/,Sausage Breakfast Muffins,4,2026-01-19 05:39:29
https://www.pinterest.com/pin/spaghetti-pizza-casserole-recipe-cooking-circuit--1075093742301905610/,Spaghetti Pizza Casserole Recipe,4,2026-01-19 05:39:31
https://www.pinterest.com/pin/1075093742301865731/,Chicken and Rice Casserole Recipe,4,2026-01-19 05:39:36
https://www.pinterest.com/pin/1075093742301800954/,Nutter Butter Balls Recipe,4,2026-01-19 05:39:42
https://www.pinterest.com/pin/1075093742301529887/,Thai Style Sweet Chili Ribs,4,2026-01-19 05:40:01
https://www.pinterest.com/pin/chicken-meatballs-recipe-cooking-circuit--1075093742301485125/,Chicken Meatballs,4,2026-01-19 05:40:04
https://www.pinterest.com/pin/1075093742300735485/,Air Fryer Chicken and Vegetables Recipe,4,2026-01-19 05:40:19
https://www.pinterest.com/pin/lemon-cream-cheese-muffins-recipe-cooking-circuit--1075093742300238865/,Lemon Cream Cheese Muffins Recipe,4,2026-01-19 05:40:26
https://www.pinterest.com/pin/1075093742300093291/,Bruschetta Chicken Pasta Recipe,4,2026-01-19 05:40:26
https://www.pinterest.com/pin/1075093742300021411/,Butterfinger Pie Recipe,4,2026-01-19 05:40:26
https://www.pinterest.com/pin/huevos-rancheros-breakfast-sandwich-recipe-cooking-circuit--1075093742299926823/,Huevos Rancheros Breakfast Sandwich Recipe,4,2026-01-19 05:40:29
https://www.pinterest.com/pin/sugar-plum-shortbread-cookies-recipe-cooking-circuit--1075093742299911459/,Sugar Plum Shortbread Cookies Recipe,4,2026-01-19 05:40:30
https://www.pinterest.com/pin/irresistible-boston-cream-pie-cupcakes-recipe-cooking-circuit--1075093742299505303/,Irresistible Boston Cream Pie Cupcakes Recipe,4,2026-01-19 05:40:37
https://www.pinterest.com/pin/crockpot-creamy-potato-hamburger-soup-recipe-cooking-circuit--1075093742298923826/,Crockpot Creamy Potato &amp; Hamburger Soup Recipe,4,2026-01-19 05:40:46
https://www.pinterest.com/pin/bear-paw-cookies-recipe-cooking-circuit--1075093742298780288/,Bear Paw Cookies Recipe,4,2026-01-19 05:40:49
https://www.pinterest.com/pin/1075093742299849271/,Apricot Honey Ham Recipe,4,2026-01-19 05:40:58
https://www.pinterest.com/pin/1075093742299078790/,Breakfast Cups Recipe,4,2026-01-19 05:41:05
https://www.pinterest.com/pin/1075093742299100636/,Peanut Butter Christmas Crack Recipe,4,2026-01-19 05:41:05
https://www.pinterest.com/pin/1075093742313272321/,Creamy Italian Meatball Soup,3,2026-01-19 05:30:42
https://www.pinterest.com/pin/1075093742313226943/,Roasted Cabbage Wedges with Onion Dijon Sauce,3,2026-01-19 05:30:45
https://www.pinterest.com/pin/1075093742313133195/,Mushroom Garlic Shrimp Pasta,3,2026-01-19 05:30:48
https://www.pinterest.com/pin/1075093742313165808/,Southern Style Shrimp and Grits,3,2026-01-19 05:30:48
https://www.pinterest.com/pin/1075093742313022705/,Cowboy Butter Chicken Linguine Recipe,3,2026-01-19 05:30:54
https://www.pinterest.com/pin/1075093742313038266/,Creamy French Onion and Mushroom Soup,3,2026-01-19 05:30:54
https://www.pinterest.com/pin/1075093742313385473/,Pineapple Upside Down Sugar Cookies,3,2026-01-19 05:30:56
https://www.pinterest.com/pin/1075093742312905695/,Slow Cooker Broccoli Cheese Soup,3,2026-01-19 05:30:59
https://www.pinterest.com/pin/1075093742312920564/,Slow Cooker Chicken Fajita Soup,3,2026-01-19 05:30:59
https://www.pinterest.com/pin/1075093742312910932/,Copycat Zuppa Toscana Recipe,3,2026-01-19 05:31:00
https://www.pinterest.com/pin/1075093742312784530/,Sweet Apricot Heart Cookies,3,2026-01-19 05:31:04
https://www.pinterest.com/pin/1075093742312766814/,Strawberry Shortbread Cookies,3,2026-01-19 05:31:07
https://www.pinterest.com/pin/1075093742312741668/,Red Velvet Truffles,3,2026-01-19 05:31:07
https://www.pinterest.com/pin/1075093742312736050/,Chocolate Peanut Butter Valentines Heart,3,2026-01-19 05:31:08
https://www.pinterest.com/pin/1075093742313216414/,Mediterranean Roasted Eggplant,3,2026-01-19 05:31:12
https://www.pinterest.com/pin/1075093742312624423/,Honey Garlic Asian Chicken Kabobs,3,2026-01-19 05:31:15
https://www.pinterest.com/pin/1075093742313158224/,Creamy Bean Soup with Sausage,3,2026-01-19 05:31:15
https://www.pinterest.com/pin/1075093742313155125/,Pesto Shrimp Mushroom Pasta,3,2026-01-19 05:31:20
https://www.pinterest.com/pin/1075093742312536757/,Creamy Sun-Dried Tomato and Ricotta Stuffed Shells,3,2026-01-19 05:31:20
https://www.pinterest.com/pin/1075093742312457836/,Crock Pot Southwest Chicken and Rice,3,2026-01-19 05:31:23
https://www.pinterest.com/pin/1075093742313010370/,Bobby Flays Goulash,3,2026-01-19 05:31:25
https://www.pinterest.com/pin/1075093742312406944/,Teriyaki Chicken Sheet Pan Supper,3,2026-01-19 05:31:26
https://www.pinterest.com/pin/1075093742312714256/,Homemade Chocolate Truffles Recipe,3,2026-01-19 05:31:37
https://www.pinterest.com/pin/1075093742312128585/,Eggplant and Sun-Dried Tomato Ricotta Pasta,3,2026-01-19 05:31:37
https://www.pinterest.com/pin/1075093742312167325/,Creamy Burrito Casserole Recipe,3,2026-01-19 05:31:38
https://www.pinterest.com/pin/1075093742312119119/,Homemade Mexican Pizza,3,2026-01-19 05:31:41
https://www.pinterest.com/pin/1075093742312022004/,Slow Cooker Cream Cheese Corn Casserole,3,2026-01-19 05:31:43
https://www.pinterest.com/pin/1075093742312001894/,Mediterranean Chicken Pasta Salad,3,2026-01-19 05:31:44
https://www.pinterest.com/pin/1075093742311856373/,Beef Tips and Gravy,3,2026-01-19 05:31:50
https://www.pinterest.com/pin/1075093742311889869/,Shipwreck Stew,3,2026-01-19 05:31:50
https://www.pinterest.com/pin/1075093742312339056/,Juicy Baked Chicken Breast,3,2026-01-19 05:31:53
https://www.pinterest.com/pin/1075093742312220162/,Cajun Chicken Recipe,3,2026-01-19 05:31:57
https://www.pinterest.com/pin/1075093742311559221/,Lobster Mac and Cheese,3,2026-01-19 05:32:03
https://www.pinterest.com/pin/1075093742311508445/,Crockpot Spinach Artichoke Dip Recipe,3,2026-01-19 05:32:04
https://www.pinterest.com/pin/1075093742311511498/,Apple Pie Bombs,3,2026-01-19 05:32:05
https://www.pinterest.com/pin/1075093742311442841/,Creamy Seafood Chowder Recipe,3,2026-01-19 05:32:08
https://www.pinterest.com/pin/1075093742311386493/,Santa Claus Macarons Recipe,3,2026-01-19 05:32:12
https://www.pinterest.com/pin/1075093742311251759/,Pumpkin Scones Recipe,3,2026-01-19 05:32:16
https://www.pinterest.com/pin/1075093742311121467/,Garlic Chicken Gnocchi Skillet,3,2026-01-19 05:32:24
https://www.pinterest.com/pin/1075093742311049776/,Cinnamon Roll Apple Pie,3,2026-01-19 05:32:26
https://www.pinterest.com/pin/1075093742311580641/,Kentucky Cream Pull Candy,3,2026-01-19 05:32:30
https://www.pinterest.com/pin/1075093742311506283/,No Bake Pumpkin Cheesecake Balls Recipe,3,2026-01-19 05:32:30
https://www.pinterest.com/pin/1075093742311404207/,Sweet and Moist Cornbread Recipe,3,2026-01-19 05:32:35
https://www.pinterest.com/pin/1075093742311563399/,Chocolate Croissant Breakfast Bake with Flaky Layers,3,2026-01-19 05:32:35
https://www.pinterest.com/pin/1075093742311035597/,Cashew Clusters Recipe,3,2026-01-19 05:32:54
https://www.pinterest.com/pin/1075093742311682157/,Cheesy Garlic Pesto Chicken Sliders,3,2026-01-19 05:33:05
https://www.pinterest.com/pin/1075093742309991212/,Chicken Caprese,3,2026-01-19 05:33:18
https://www.pinterest.com/pin/1075093742309979346/,Cranberry Turkey Stuffing Balls,3,2026-01-19 05:33:19
https://www.pinterest.com/pin/1075093742309636109/,Classic Christmas Toffee,3,2026-01-19 05:33:38
https://www.pinterest.com/pin/1075093742309559994/,Halloween Midnight Galaxy Fudge,3,2026-01-19 05:33:42
https://www.pinterest.com/pin/1075093742309447916/,Halloween Crispy Treat Brownies,3,2026-01-19 05:33:47
https://www.pinterest.com/pin/1075093742309328338/,Air Fryer Nutella Bombs,3,2026-01-19 05:33:50
https://www.pinterest.com/pin/1075093742309302185/,Blueberry Lemon French Toast Bake,3,2026-01-19 05:33:52
https://www.pinterest.com/pin/1075093742309263898/,Easy Beef and Potato Casserole,3,2026-01-19 05:33:55
https://www.pinterest.com/pin/1075093742308906881/,Million Dollar Spaghetti Casserole,3,2026-01-19 05:34:09
https://www.pinterest.com/pin/1075093742308876610/,Candy Corn Pretzel Hugs,3,2026-01-19 05:34:10
https://www.pinterest.com/pin/1075093742308891629/,Monster Cookie Bars,3,2026-01-19 05:34:10
https://www.pinterest.com/pin/1075093742308808796/,Easy Cream Cheese Chicken,3,2026-01-19 05:34:13
https://www.pinterest.com/pin/1075093742308688602/,Pumpkin White Chocolate Chip Cookies,3,2026-01-19 05:34:17
https://www.pinterest.com/pin/1075093742308707942/,Ritzy Chicken Casserole,3,2026-01-19 05:34:18
https://www.pinterest.com/pin/1075093742308635803/,Garlic Butter Chicken and Rice,3,2026-01-19 05:34:20
https://www.pinterest.com/pin/1075093742308566081/,Vegan Blueberry Ice Cream,3,2026-01-19 05:34:23
https://www.pinterest.com/pin/1075093742308560958/,Delicious Cherry Garcia Ice Cream,3,2026-01-19 05:34:26
https://www.pinterest.com/pin/1075093742308499850/,Jerk Chicken Bowls with Pineapple Black Bean Salsa,3,2026-01-19 05:34:30
https://www.pinterest.com/pin/1075093742308336136/,Slow Cooker Cream Cheese Crack Chicken Chili,3,2026-01-19 05:34:36
https://www.pinterest.com/pin/1075093742308283156/,Healthy Garlic Parmesan Chicken Pasta Recipe,3,2026-01-19 05:34:40
https://www.pinterest.com/pin/1075093742308190165/,Chicken Salmoriglio,3,2026-01-19 05:34:43
https://www.pinterest.com/pin/1075093742307915474/,Teriyaki Salmon Sushi Bake for Two,3,2026-01-19 05:34:55
https://www.pinterest.com/pin/1075093742307862331/,Shrimp Rice Bowls with Spicy Mayo,3,2026-01-19 05:34:56
https://www.pinterest.com/pin/1075093742307838021/,Unstuffed Peppers Recipe,3,2026-01-19 05:34:59
https://www.pinterest.com/pin/1075093742307605102/,Creamy Garlic Chicken Pasta,3,2026-01-19 05:35:08
https://www.pinterest.com/pin/1075093742307594194/,Slow Cooker Chicken Curry Recipe,3,2026-01-19 05:35:11
https://www.pinterest.com/pin/1075093742307565478/,Mama &amp; Puerto Rican Chicken and Rice,3,2026-01-19 05:35:12
https://www.pinterest.com/pin/1075093742307275199/,Pumpkin Bars with Cream Cheese Frosting,3,2026-01-19 05:35:25
https://www.pinterest.com/pin/1075093742307335247/,Pumpkin Coffee Cake Recipe,3,2026-01-19 05:35:26
https://www.pinterest.com/pin/1075093742307026136/,Peach Dump Cake Recipe,3,2026-01-19 05:35:37
https://www.pinterest.com/pin/1075093742307005764/,Cheesy Garlic and Herb Bread,3,2026-01-19 05:35:37
https://www.pinterest.com/pin/1075093742306984126/,Mexican Pasta Salad with Flank Steak,3,2026-01-19 05:35:39
https://www.pinterest.com/pin/1075093742306736786/,Pasta e Ceci,3,2026-01-19 05:35:49
https://www.pinterest.com/pin/chicken-and-rice-taco-skillet-cooking-circuit--1075093742306504254/,Chicken and Rice Taco Skillet,3,2026-01-19 05:36:00
https://www.pinterest.com/pin/chicken-fajita-burrito-bowl-cooking-circuit--1075093742306492175/,Chicken Fajita Burrito Bowl,3,2026-01-19 05:36:02
https://www.pinterest.com/pin/caramelized-lemon-butter-orzo-with-kale-and-garlic-breadcrumbs-cooking-circuit--1075093742306442250/,Caramelized Lemon Butter Orzo with Kale and Garlic Breadcrumbs,3,2026-01-19 05:36:04
https://www.pinterest.com/pin/creamy-spinach-turkey-meatballs-cooking-circuit--1075093742306380915/,Creamy Spinach Turkey Meatballs,3,2026-01-19 05:36:08
https://www.pinterest.com/pin/creamy-broccoli-pasta-cooking-circuit--1075093742306306207/,Creamy Broccoli Pasta,3,2026-01-19 05:36:15
https://www.pinterest.com/pin/coconut-key-lime-crumb-bars-cooking-circuit--1075093742306258680/,Coconut Key Lime Crumb Bars,3,2026-01-19 05:36:15
https://www.pinterest.com/pin/cheese-tortellini-sausage-spinach-cooking-circuit--1075093742306685691/,Cheese Tortellini Sausage Spinach,3,2026-01-19 05:36:19
https://www.pinterest.com/pin/slow-cooker-barbacoarecipe-cooking-circuit--1075093742306133634/,Slow Cooker Barbacoa&nbsp;Recipe,3,2026-01-19 05:36:21
https://www.pinterest.com/pin/1075093742305678523/,Healthy Peach Oatmeal Breakfast Cookies,3,2026-01-19 05:36:43
https://www.pinterest.com/pin/1075093742305446393/,Healthy Chicken Breast with Zucchini and Squash,3,2026-01-19 05:36:54
https://www.pinterest.com/pin/1075093742305443679/,Easy Ground Turkey Vegetable Skillet,3,2026-01-19 05:36:56
https://www.pinterest.com/pin/1075093742305340843/,Asado Chicken and Sauteed Lemon Zucchini,3,2026-01-19 05:37:00
https://www.pinterest.com/pin/famous-la-scala-chopped-salad-recipe-cooking-circuit--1075093742305275891/,Famous La Scala Chopped Salad Recipe,3,2026-01-19 05:37:02
https://www.pinterest.com/pin/1075093742305246460/,Sheet Pan Gnocchi Recipe,3,2026-01-19 05:37:03
https://www.pinterest.com/pin/1075093742305243176/,Creamy Chicken Sausage Orzo Skillet,3,2026-01-19 05:37:03
https://www.pinterest.com/pin/1075093742305236212/,Sheet Pan Mediterranean Shrimp,3,2026-01-19 05:37:03
https://www.pinterest.com/pin/1075093742305150282/,Crispy Sesame Chicken and Fried Rice,3,2026-01-19 05:37:07
https://www.pinterest.com/pin/1075093742305070749/,Healthy Ground Turkey Teriyaki Rice Bowl,3,2026-01-19 05:37:13
https://www.pinterest.com/pin/1075093742305010776/,Zucchini Beef Chicken Bake,3,2026-01-19 05:37:13
https://www.pinterest.com/pin/1075093742304999959/,Grilled Hawaiian Chicken Bowls,3,2026-01-19 05:37:17
https://www.pinterest.com/pin/spicy-ginger-chicken-delight-cooking-circuit--1075093742304863157/,Spicy Ginger Chicken Delight,3,2026-01-19 05:37:19
https://www.pinterest.com/pin/chili-lime-quinoa-black-bean-salad-cooking-circuit--1075093742304165028/,Chili Lime Quinoa Black Bean Salad,3,2026-01-19 05:37:29
https://www.pinterest.com/pin/1075093742304002681/,Breakfast Burrito Bowl,3,2026-01-19 05:37:37
https://www.pinterest.com/pin/1075093742304050554/,High protein creamy roasted red pepper pasta,3,2026-01-19 05:37:38
https://www.pinterest.com/pin/sticky-chicken-rice-bowls-recipe-cooking-circuit--1075093742303971137/,Sticky Chicken Rice Bowls Recipe,3,2026-01-19 05:37:39
https://www.pinterest.com/pin/1075093742305157908/,Roasted Potatoes with Baked Feta and Garlic,3,2026-01-19 05:37:41
https://www.pinterest.com/pin/1075093742304908080/,BBQ Ranch Chicken Casserole,3,2026-01-19 05:37:44
https://www.pinterest.com/pin/cuban-chicken-black-bean-rice-bowls-cooking-circuit--1075093742303866687/,Cuban Chicken &amp; Black Bean Rice Bowls,3,2026-01-19 05:37:47
https://www.pinterest.com/pin/1075093742303745406/,Sweet Chili Roasted Chicken and Vegetables,3,2026-01-19 05:37:52
https://www.pinterest.com/pin/1075093742303666036/,Cucumber Shrimp Salad,3,2026-01-19 05:37:57
https://www.pinterest.com/pin/1075093742304235485/,Balsamic Glazed Chicken and Veggies,3,2026-01-19 05:37:59
https://www.pinterest.com/pin/1075093742303609933/,Greek Chicken Tzatziki Bowls Recipe,3,2026-01-19 05:38:00
https://www.pinterest.com/pin/1075093742303577211/,Smoky Sweet Potato and Chickpea Sheet Pan,3,2026-01-19 05:38:00
https://www.pinterest.com/pin/lemony-brown-butter-salmon-and-rosemary-potatoes-with-garlic-asparagus-cooking-circuit--1075093742303487309/,Lemony Brown Butter Salmon and Rosemary Potatoes with Garlic Asparagus,3,2026-01-19 05:38:06
https://www.pinterest.com/pin/1075093742303448669/,Sheet Pan Sausage and Sweet Potatoes with Honey Garlic Sauce,3,2026-01-19 05:38:06
https://www.pinterest.com/pin/mini-nobake-lemon-cheesecake-tarts-cooking-circuit--1075093742303396298/,Mini No-Bake Lemon Cheesecake Tarts,3,2026-01-19 05:38:09
https://www.pinterest.com/pin/ground-beef-meat-pie-cooking-circuit--1075093742303366384/,Ground Beef Meat Pie,3,2026-01-19 05:38:10
https://www.pinterest.com/pin/one-pan-garlic-roasted-chicken-and-baby-potatoes-cooking-circuit--1075093742303363324/,One Pan Garlic Roasted Chicken and Baby Potatoes,3,2026-01-19 05:38:11
https://www.pinterest.com/pin/1075093742303107449/,One Skillet Salmon with Lemon Orzo,3,2026-01-19 05:38:21
https://www.pinterest.com/pin/enchilada-skillet-cooking-circuit--1075093742302936688/,Enchilada Skillet,3,2026-01-19 05:38:33
https://www.pinterest.com/pin/1075093742302938796/,Skinny Cajun Chicken Pasta,3,2026-01-19 05:38:33
https://www.pinterest.com/pin/chicken-fajita-rice-bowl-cooking-circuit--1075093742303382570/,Chicken Pad Thai,3,2026-01-19 05:38:35
https://www.pinterest.com/pin/1075093742302838193/,Creamy Boursin Orzo with Chicken,3,2026-01-19 05:38:36
https://www.pinterest.com/pin/baked-tuscan-chicken-casserole-cooking-circuit--1075093742302780659/,Baked Tuscan Chicken Casserole,3,2026-01-19 05:38:39
https://www.pinterest.com/pin/crispy-hot-honey-feta-chicken-cooking-circuit--1075093742302611699/,Crispy Hot Honey Feta Chicken,3,2026-01-19 05:38:47
https://www.pinterest.com/pin/sweet-potato-breakfast-hash-with-black-beans-cooking-circuit--1075093742302617404/,Sweet Potato Breakfast Hash with Black Beans,3,2026-01-19 05:38:47
https://www.pinterest.com/pin/california-turkey-club-wraps-cooking-circuit--1075093742302589248/,California Turkey Club Wraps,3,2026-01-19 05:38:50
https://www.pinterest.com/pin/bang-bang-chicken-bowls-cooking-circuit--1075093742303005896/,Bang Bang Chicken Bowls,3,2026-01-19 05:38:51
https://www.pinterest.com/pin/thai-peanut-sweet-potato-buddha-bowl-cooking-circuit--1075093742302953609/,Thai Peanut Sweet Potato Buddha Bowl,3,2026-01-19 05:39:00
